### ISSUE TITLE
[VPP-1696] ARP reply is not working

### ISSUE THREAD

**Issue by vvalderrv** [FDio/vpp#3159]
### Description
Found the bug in VPP 19.04, but also was able to reproduce it with VPP 19.01.

ARP reply is not working if a static ARP entry has been created on VPP for the requested IP address pointing towards another interface. In the following setup, the issue is that ARP request comes to VPP, VPP trace says ARP reply sent, but it is not actually sent.

<h2><a name="%C2%A0Setup"></a> Setup</h2>
<div class="preformatted panel" style="border-width: 1px;"><div class="preformattedContent panelContent">
<pre>+----------------------------------------------------+   +----------------+
|  +---------------------------+                     |   |                |
|  |                           |                     |   |                |
|  |            +--------+     |                     |   |  +--------+    |
|  |            |        |     |                     |   |  |        |    |
|  |            |  tap1  +----------------------------------+  tap1  |    |
|  |            |        |     |                     |   |  |        |    |
|  |            +--------+     |                     |   |  +--------+    |
|  |            10.10.1.1/24   |                     |   |  10.10.1.20/24 |
|  |                           |                     |   |                |
|  |            +--------+     |  +--------+         |   |                |
|  |            |        |     |  |        |         |   |                |
|  |            |  tap2  +--------+  tap2  |         |   |                |
|  |            |        |     |  |        |         |   |                |
|  |            +--------+     |  +--------+         |   |                |
|  |  VPP       10.10.10.10/24 |  10.10.1.1/24       |   |                |
|  |                           |  ca:30:a0:34:37:cd  |   |                |
|  +---------------------------+                     |   |                |
|                                                    |   |                |
| Container 1                                        |   |  Container 2   |
+----------------------------------------------------+   +----------------+</pre>
</div></div>

	- <span class="error">[In Container 1]</span> Create TAP1 and TAP 2. Add IP punt redirect

<div class="preformatted panel" style="border-width: 1px;"><div class="preformattedContent panelContent">
<pre>vppctl create tap id 1 host-if-name tap1
vppctl set int ip addr tap1 10.10.1.1/24
vppctl set int state tap1 up 

vppctl create tap id 2 host-if-name tap2
vppctl set int ip addr tap2 10.10.10.10/24
vppctl set int state tap2 up

vppctl ip punt redirect add rx tap1 via 10.10.1.1 tap2</pre>
</div></div>

	- <span class="error">[In Container 1]</span> Set ip address of the Linux side of TAP2

<div class="preformatted panel" style="border-width: 1px;"><div class="preformattedContent panelContent">
<pre>ip address add 10.10.1.1/24 dev tap2</pre>
</div></div>

	- <span class="error">[In Container 1]</span> Add ARP entry

<div class="preformatted panel" style="border-width: 1px;"><div class="preformattedContent panelContent">
<pre>vppctl set ip arp tap2 10.10.1.1 ca:30:a0:34:37:cd</pre>
</div></div>
<tt>ca:30:a0:34:37:cd</tt> is the MAC address of the Linux side of TAP2

	- Move the Linux side of TAP1 to another namespace (client container)
	- <span class="error">[In Container 2]</span> Set ip address of the Linux side of TAP1 and bring it up

<div class="preformatted panel" style="border-width: 1px;"><div class="preformattedContent panelContent">
<pre>ip address add 10.10.1.20/24 dev tap1
ip link set dev tap1 up</pre>
</div></div>
<h2><a name="Configurationaftersetup"></a>Configuration after setup</h2>
<ul class="alternate" type="square">
	- VPP in Container 1

<div class="preformatted panel" style="border-width: 1px;"><div class="preformattedContent panelContent">
<pre>vpp# show int addr
GigabitEthernet0/19/0 (dn):
local0 (dn):
tap1 (up):
    L3 10.10.1.1/24
tap2 (up):
    L3 10.10.10.10/24

vpp# show ip arp
Time           IP4       Flags      Ethernet              Interface
254.3595    10.10.1.1      D    ca:30:a0:34:37:cd tap2

vpp# show ip punt redirect
    rx tap1 redirect via 10.10.1.1 tap2
</pre>
</div></div>
<ul class="alternate" type="square">
	- Container 1

<div class="preformatted panel" style="border-width: 1px;"><div class="preformattedContent panelContent">
<pre>root@07e62ae5f36d:/# ip a
... skipped lines for brevity
3: tap2: <BROADCAST,MULTICAST,UP,LOWER_UP> mtu 1500 qdisc fq_codel state UNKNOWN group default qlen 1000
    link/ether ca:30:a0:34:37:cd brd ff:ff:ff:ff:ff:ff
    inet 10.10.1.1/24 scope global tap2
    valid_lft forever preferred_lft forever</pre>
</div></div>
<ul class="alternate" type="square">
	- Container 2

<div class="preformatted panel" style="border-width: 1px;"><div class="preformattedContent panelContent">
<pre>root@b18853f5f328:/# ip a
... skipped lines for brevity
2: tap1: <BROADCAST,MULTICAST,UP,LOWER_UP> mtu 1500 qdisc fq_codel state UNKNOWN group default qlen 1000
    link/ether 62:01:5e:32:b3:9c brd ff:ff:ff:ff:ff:ff
    inet 10.10.1.20/24 scope global tap1
    valid_lft forever preferred_lft forever</pre>
</div></div>
<h2><a name="Theissue"></a>The issue</h2>
<ul class="alternate" type="square">
	- Ping from Container 2

<div class="preformatted panel" style="border-width: 1px;"><div class="preformattedContent panelContent">
<pre>root@b18853f5f328:/# ping -c 1 10.10.1.1
PING 10.10.1.1 (10.10.1.1) 56(84) bytes of data.
From 10.10.1.20 icmp_seq=1 Destination Host Unreachable    

--- 10.10.1.1 ping statistics ---
1 packets transmitted, 0 received, +1 errors, 100% packet loss, time 0ms 

root@b18853f5f328:/# </pre>
</div></div>
<ul class="alternate" type="square">
	- Tcpdump in Container 2

<div class="preformatted panel" style="border-width: 1px;"><div class="preformattedContent panelContent">
<pre>root@b18853f5f328:/# tcpdump -i tap1 -v
tcpdump: listening on tap1, link-type EN10MB (Ethernet), capture size 262144 bytes
14:19:24.407699 ARP, Ethernet (len 6), IPv4 (len 4), Request who-has 10.10.1.1 tell 10.10.1.20, length 28
14:19:25.435430 ARP, Ethernet (len 6), IPv4 (len 4), Request who-has 10.10.1.1 tell 10.10.1.20, length 28
14:19:26.459430 ARP, Ethernet (len 6), IPv4 (len 4), Request who-has 10.10.1.1 tell 10.10.1.20, length 2</pre>
</div></div>
<ul class="alternate" type="square">
	- Trace in VPP

<div class="preformatted panel" style="border-width: 1px;"><div class="preformattedContent panelContent">
<pre>Packet 1

00:11:57:580131: virtio-input
virtio: hw_if_index 2 next-index 4 vring 0 len 42
    hdr: flags 0x00 gso_type 0x00 hdr_len 0 gso_size 0 csum_start 0 csum_offset 0 num_buffers 1
00:11:57:580148: ethernet-input
ARP: 62:01:5e:32:b3:9c -> ff:ff:ff:ff:ff:ff
00:11:57:580159: arp-input
request, type ethernet/IP4, address size 6/4
62:01:5e:32:b3:9c/10.10.1.20 -> 00:00:00:00:00:00/10.10.1.1
00:11:57:580170: error-drop
arp-input: ARP replies sent

Packet 2

00:11:58:608857: virtio-input
virtio: hw_if_index 2 next-index 4 vring 0 len 42
    hdr: flags 0x00 gso_type 0x00 hdr_len 0 gso_size 0 csum_start 0 csum_offset 0 num_buffers 1
00:11:58:608865: ethernet-input
ARP: 62:01:5e:32:b3:9c -> ff:ff:ff:ff:ff:ff
00:11:58:608868: arp-input
request, type ethernet/IP4, address size 6/4
62:01:5e:32:b3:9c/10.10.1.20 -> 00:00:00:00:00:00/10.10.1.1
00:11:58:608878: error-drop
arp-input: ARP replies sent

Packet 3

00:11:59:633814: virtio-input
virtio: hw_if_index 2 next-index 4 vring 0 len 42
    hdr: flags 0x00 gso_type 0x00 hdr_len 0 gso_size 0 csum_start 0 csum_offset 0 num_buffers 1
00:11:59:633820: ethernet-input
ARP: 62:01:5e:32:b3:9c -> ff:ff:ff:ff:ff:ff
00:11:59:633824: arp-input
request, type ethernet/IP4, address size 6/4
62:01:5e:32:b3:9c/10.10.1.20 -> 00:00:00:00:00:00/10.10.1.1
00:11:59:633835: error-drop
arp-input: ARP replies sent</pre>
</div></div>
<ul class="alternate" type="square">
	- Interfaces:

<div class="preformatted panel" style="border-width: 1px;"><div class="preformattedContent panelContent">
<pre>vpp# sh int
            Name               Idx    State  MTU (L3/IP4/IP6/MPLS)     Counter          Count     
GigabitEthernet0/19/0             1     down         9000/0/0/0     
local0                            0     down          0/0/0/0       
tap1                              2      up          9000/0/0/0     rx packets                     3
                                                                    rx bytes                     126
                                                                    drops                          3
tap2                              3      up          9000/0/0/0     
vpp# </pre>
</div></div>
<ul class="alternate" type="square">
	- Errors in VPP:

<div class="preformatted panel" style="border-width: 1px;"><div class="preformattedContent panelContent">
<pre>vpp# sh err
    Count                    Node                  Reason
        3                arp-input               ARP replies sent
vpp#</pre>
</div></div>
Please note that there are no tx packets on the tap1 interface, and the ARP reply was not received by the Linux (tcpdump in Container2).

### Assignee
Neale Ranns

### Reporter
Andrii Zakurenyi

### Comments
- **milanlenco (Fri, 7 Jun 2019 07:49:20 +0000)**: Hi Neale,

<p>so I tried the same setup but using binary API as opposed to CLI and now it seems to be working at least for TCP. However UDP (which we target for) seems to be broken.

 I'm re-posting the scheme as my setup uses different tap indexes and MAC addresses:</p>
<div class="code panel" style="border-width: 1px;"><div class="codeContent panelContent">
<pre class="code-java">+-----------------------------------------------------+   +-------------------+
|  +----------------------------+                     |   |                   |
|  |                            |                     |   |                   |
|  |            +--------+      |                     |   |  +--------+       |
|  |            |        |      |                     |   |  |        |       |
|  |            |  tap0  +-----------------------------------+  tap0  |       |
|  |            |        |      |                     |   |  |        |       |
|  |            +--------+      |                     |   |  +--------+       |
|  |            10.10.1.1/24    |                     |   |  10.10.1.20/24    |
|  |          dd:dd:dd:dd:dd:dd |                     |   | cc:cc:cc:cc:cc:cc |
|  |                            |                     |   |                   |
|  |            +--------+      |  +--------+         |   |                   |
|  |            |        |      |  |        |         |   |                   |
|  |            |  tap1  +---------+  tap1  |         |   |                   |
|  |            |        |      |  |        |         |   |                   |
|  |            +--------+      |  +--------+         |   |                   |
|  |  VPP     unnum. - use tap0 |  10.10.1.1/24       |   |                   |
|  |          bb:bb:bb:bb:bb:bb |  aa:aa:aa:aa:aa:aa  |   |                   |
|  +----------------------------+                     |   |                   |
|                                                     |   |                   |
| Container 1                                         |   |  Container 2      |
+-----------------------------------------------------+   +-------------------+
</pre>
</div></div>
Note that I tried to switch the unnumbered interface between tap0 and tap1, but it only broke the already working TCP and didn't help UDP. Also I have added proxy ARP which might have actually helped to fix the original ARP issue.

<p>Here is the API trace <span class="nobr"><a href="https://jira.fd.io/secure/attachment/12406/12406_punt.api" title="punt.api attached to VPP-1696">punt.api<sup><img class="rendericon" src="https://jira.fd.io/images/icons/link_attachment_7.gif" height="7" width="7" align="absmiddle" alt="" border="0"/></sup></a></span> (and it's dump: <span class="nobr"><a href="https://jira.fd.io/secure/attachment/12407/12407_punt.api.txt" title="punt.api.txt attached to VPP-1696">punt.api.txt<sup><img class="rendericon" src="https://jira.fd.io/images/icons/link_attachment_7.gif" height="7" width="7" align="absmiddle" alt="" border="0"/></sup></a></span>)

 Here is the output from show CLI commands:</p>
<div class="code panel" style="border-width: 1px;"><div class="codeContent panelContent">
<pre class="code-java">DBGvpp# sh <span class="code-object">int</span> addr         
GigabitEthernet0/8/0 (dn):
local0 (dn):
tap0 (up):
  L3 10.10.1.1/24
tap1 (up): 
  unnumbered, use tap0
  L3 10.10.1.1/24

DBGvpp# sh ip punt redirect 
 rx tap0 redirect via 10.10.1.1 tap1

DBGvpp# sh ip arp 
    Time           IP4       Flags      Ethernet              Interface       
    477.3495   10.10.1.20      D    cc:cc:cc:cc:cc:cc tap0
     30.9754    10.10.1.1     SN    aa:aa:aa:aa:aa:aa tap1
Proxy arps enabled <span class="code-keyword">for</span>:
Fib_index 0   10.10.1.1 - 10.10.1.255

DBGvpp# sh hard
              Name                Idx   Link  Hardware
0: format_dpdk_device:594: rte_eth_dev_rss_hash_conf_get returned -95
GigabitEthernet0/8/0               1    down  GigabitEthernet0/8/0
  Link speed: 1 Gbps
  Ethernet address 08:00:27:d3:e3:ec
  Intel 82540EM (e1000)
    carrier up full duplex mtu 9206 
    flags: pmd maybe-multiseg tx-offload intel-phdr-cksum rx-ip4-cksum
    rx: queues 1 (max 1), desc 1024 (min 32 max 4096 align 8)
    tx: queues 1 (max 1), desc 1024 (min 32 max 4096 align 8)
    pci: device 8086:100f subsystem 15ad:0750 address 0000:00:08.00 numa 0
    module: unknown
    max rx packet len: 16128
    promiscuous: unicast off all-multicast off
    vlan offload: strip off filter off qinq off
    rx offload avail:  vlan-strip ipv4-cksum udp-cksum tcp-cksum [^udp-trace.txt]  vlan-filter 
                       jumbo-frame scatter keep-crc 
    rx offload active: ipv4-cksum jumbo-frame scatter 
    tx offload avail:  vlan-insert ipv4-cksum udp-cksum tcp-cksum multi-segs 
    tx offload active: udp-cksum tcp-cksum multi-segs 
    rss avail:         none
    rss active:        none
    tx burst function: eth_em_xmit_pkts
    rx burst function: eth_em_recv_pkts

local0                             0    down  local0
  Link speed: unknown
  local
tap0                               2     up   tap0
  Link speed: unknown
  Ethernet address dd:dd:dd:dd:dd:dd
  VIRTIO <span class="code-keyword">interface</span>
     instance 0
tap1                               3     up   tap1
  Link speed: unknown
  Ethernet address bb:bb:bb:bb:bb:bb
  VIRTIO <span class="code-keyword">interface</span>
     instance 1
</pre>
</div></div>
<p>Here is a snipped of packet trace of working TCP: <span class="nobr"><a href="https://jira.fd.io/secure/attachment/12408/12408_tcp-trace.txt" title="tcp-trace.txt attached to VPP-1696">tcp-trace.txt<sup><img class="rendericon" src="https://jira.fd.io/images/icons/link_attachment_7.gif" height="7" width="7" align="absmiddle" alt="" border="0"/></sup></a></span> 

 And here is a packet trace of failing UDP: <span class="nobr"><a href="https://jira.fd.io/secure/attachment/12409/12409_udp-trace.txt" title="udp-trace.txt attached to VPP-1696">udp-trace.txt<sup><img class="rendericon" src="https://jira.fd.io/images/icons/link_attachment_7.gif" height="7" width="7" align="absmiddle" alt="" border="0"/></sup></a></span>

 It seems that UDP packets do not get punted.</p>

Note, to test the traffic I was using netcat:

<div class="code panel" style="border-width: 1px;"><div class="codeContent panelContent">
<pre class="code-java">Container1:
$ nc -l -p 8080 &
$ nc -u -l -p 9090 &

Container2:
$ nc 10.10.1.1 8080 # OK
$ nc -u 10.10.1.1 9090 # FAIL
</pre>
</div></div>

<p>Thanks,

Milan</p>
- **rewenset (Thu, 6 Jun 2019 10:38:55 +0000)**: <p>nope, doesn't work.

 In order to test this thing, I do `<tt>nc -l 8080</tt>` inside container1 and `<tt>nc 10.10.1.1 8080</tt>` inside container2.

 VPP setup:</p>
<div class="preformatted panel" style="border-width: 1px;"><div class="preformattedContent panelContent">
<pre>vpp# sh int addr
GigabitEthernet0/19/0 (dn):
local0 (dn):
tap1 (up):
  unnumbered, use tap2
  L3 10.10.1.1/24
tap2 (up):
  L3 10.10.1.1/24
vpp#
</pre>
</div></div>
VPP trace:

<div class="preformatted panel" style="border-width: 1px;"><div class="preformattedContent panelContent">
<pre>------------------- Start of thread 0 vpp_main -------------------
Packet 1

00:14:52:915438: virtio-input
  virtio: hw_if_index 3 next-index 4 vring 0 len 74
    hdr: flags 0x00 gso_type 0x00 hdr_len 0 gso_size 0 csum_start 0 csum_offset 0 num_buffers 1
00:14:52:915445: ethernet-input
  IP4: 42:c4:fd:6d:1d:52 -> 02:fe:17:5d:75:6b
00:14:52:915449: ip4-input
  TCP: 10.10.1.20 -> 10.10.1.1
    tos 0x00, ttl 64, length 60, checksum 0xb23c
    fragment id 0x7257, flags DONT_FRAGMENT
  TCP: 51356 -> 8080
    seq. 0x1f329aaf ack 0x00000000
    flags 0x02 SYN, tcp header: 40 bytes
    window 29200, checksum 0x12b6
00:14:52:915453: ip4-lookup
  fib 0 dpo-idx 5 flow hash: 0x00000000
  TCP: 10.10.1.20 -> 10.10.1.1
    tos 0x00, ttl 64, length 60, checksum 0xb23c
    fragment id 0x7257, flags DONT_FRAGMENT
  TCP: 51356 -> 8080
    seq. 0x1f329aaf ack 0x00000000
    flags 0x02 SYN, tcp header: 40 bytes
    window 29200, checksum 0x12b6
00:14:52:915455: ip4-local
    TCP: 10.10.1.20 -> 10.10.1.1
      tos 0x00, ttl 64, length 60, checksum 0xb23c
      fragment id 0x7257, flags DONT_FRAGMENT
    TCP: 51356 -> 8080
      seq. 0x1f329aaf ack 0x00000000
      flags 0x02 SYN, tcp header: 40 bytes
      window 29200, checksum 0x12b6
00:14:52:915459: ip4-punt
    TCP: 10.10.1.20 -> 10.10.1.1
      tos 0x00, ttl 64, length 60, checksum 0xb23c
      fragment id 0x7257, flags DONT_FRAGMENT
    TCP: 51356 -> 8080
      seq. 0x1f329aaf ack 0x00000000
      flags 0x02 SYN, tcp header: 40 bytes
      window 29200, checksum 0x12b6
00:14:52:915460: ip4-punt-redirect
  via 10.10.1.1 on tap2 using adj:1
00:14:52:915461: ip4-rewrite
  tx_sw_if_index 2 dpo-idx 1 : ipv4 via 10.10.1.1 tap2: mtu:9000 326f8eed1ed802fe6dc1f5810800 flow hash: 0x00000000
  00000000: 326f8eed1ed802fe6dc1f58108004500003c725740003f06b33c0a0a01140a0a
  00000020: 0101c89c1f901f329aaf00000000a002721012b60000020405b40402
00:14:52:915463: tap2-output
  tap2 l4-cksum-computed l4-cksum-correct l2_hdr_offset_valid l3_hdr_offset_valid 
  IP4: 02:fe:6d:c1:f5:81 -> 32:6f:8e:ed:1e:d8
  TCP: 10.10.1.20 -> 10.10.1.1
    tos 0x00, ttl 63, length 60, checksum 0xb33c
    fragment id 0x7257, flags DONT_FRAGMENT
  TCP: 51356 -> 8080
    seq. 0x1f329aaf ack 0x00000000
    flags 0x02 SYN, tcp header: 40 bytes
    window 29200, checksum 0x12b6

Packet 2

00:14:52:915517: virtio-input
  virtio: hw_if_index 2 next-index 4 vring 0 len 42
    hdr: flags 0x00 gso_type 0x00 hdr_len 0 gso_size 0 csum_start 0 csum_offset 0 num_buffers 1
00:14:52:915517: ethernet-input
  ARP: 32:6f:8e:ed:1e:d8 -> ff:ff:ff:ff:ff:ff
00:14:52:915518: arp-input
  request, type ethernet/IP4, address size 6/4
  32:6f:8e:ed:1e:d8/10.10.1.1 -> 00:00:00:00:00:00/10.10.1.20
00:14:52:915524: error-drop
  rx:tap2
00:14:52:915525: drop
  arp-input: IP4 source address matches local interface</pre>
</div></div>
- **nranns (Wed, 5 Jun 2019 12:47:39 +0000)**: ok got it.

try with VPP tap2 with 10.10.1.1/24 and tap1 unnumbered (to tap2).
- **rewenset (Wed, 5 Jun 2019 12:39:05 +0000)**: Hi, <a href="https://jira.fd.io/secure/ViewProfile.jspa?name=nranns" class="user-hover" rel="nranns">Neale Ranns</a>

<p> Why does VPP's tap1 have the same IP address and subnet as container2's tap2?

 container2 does not have tap2 <img class="emoticon" src="https://jira.fd.io/images/icons/emoticons/smile.png" height="16" width="16" align="absmiddle" alt="" border="0"/> but anyway

 VPP tap1 is supposed to be a default gateway for the local network that container2 represents. But some of the packets that go to the default gateway (10.10.1.1) need to be punted from VPP towards the linux namespace of the container1 (via tap2). Therefore the tap2 IP address in the linux (container1) must be the same as VPP tap1.</p>

 IP address of the tap2 interface on VPP is not important, we just assigned some to put in into the l3 mode. It can be just unnumbered with IP of tap1.
- **nranns (Wed, 5 Jun 2019 11:58:57 +0000)**: Hi,

can you explain your choice of addressing scheme please. why does VPP's tap1 have the same IP address and subnet as container2's tap2? Why is VPP's tap2 interface is a separate subnet?

thanks

Original issue: https://jira.fd.io/browse/VPP-1696

**Comment by vvalderrv** [comment]
<p>Hi Neale,</p>

<p>so I tried the same setup but using binary API as opposed to CLI and now it seems to be working at least for TCP. However UDP (which we target for) seems to be broken.<br/>
 I'm re-posting the scheme as my setup uses different tap indexes and MAC addresses:</p>
<div class="code panel" style="border-width: 1px;"><div class="codeContent panelContent">
<pre class="code-java">+-----------------------------------------------------+   +-------------------+
|  +----------------------------+                     |   |                   |
|  |                            |                     |   |                   |
|  |            +--------+      |                     |   |  +--------+       |
|  |            |        |      |                     |   |  |        |       |
|  |            |  tap0  +-----------------------------------+  tap0  |       |
|  |            |        |      |                     |   |  |        |       |
|  |            +--------+      |                     |   |  +--------+       |
|  |            10.10.1.1/24    |                     |   |  10.10.1.20/24    |
|  |          dd:dd:dd:dd:dd:dd |                     |   | cc:cc:cc:cc:cc:cc |
|  |                            |                     |   |                   |
|  |            +--------+      |  +--------+         |   |                   |
|  |            |        |      |  |        |         |   |                   |
|  |            |  tap1  +---------+  tap1  |         |   |                   |
|  |            |        |      |  |        |         |   |                   |
|  |            +--------+      |  +--------+         |   |                   |
|  |  VPP     unnum. - use tap0 |  10.10.1.1/24       |   |                   |
|  |          bb:bb:bb:bb:bb:bb |  aa:aa:aa:aa:aa:aa  |   |                   |
|  +----------------------------+                     |   |                   |
|                                                     |   |                   |
| Container 1                                         |   |  Container 2      |
+-----------------------------------------------------+   +-------------------+
</pre>
</div></div>
<p>Note that I tried to switch the unnumbered interface between tap0 and tap1, but it only broke the already working TCP and didn't help UDP. Also I have added proxy ARP which might have actually helped to fix the original ARP issue.</p>

<p>Here is the API trace <span class="nobr"><a href="https://jira.fd.io/secure/attachment/12406/12406_punt.api" title="punt.api attached to VPP-1696">punt.api<sup><img class="rendericon" src="https://jira.fd.io/images/icons/link_attachment_7.gif" height="7" width="7" align="absmiddle" alt="" border="0"/></sup></a></span> (and it's dump: <span class="nobr"><a href="https://jira.fd.io/secure/attachment/12407/12407_punt.api.txt" title="punt.api.txt attached to VPP-1696">punt.api.txt<sup><img class="rendericon" src="https://jira.fd.io/images/icons/link_attachment_7.gif" height="7" width="7" align="absmiddle" alt="" border="0"/></sup></a></span>)<br/>
 Here is the output from show CLI commands:</p>
<div class="code panel" style="border-width: 1px;"><div class="codeContent panelContent">
<pre class="code-java">DBGvpp# sh <span class="code-object">int</span> addr         
GigabitEthernet0/8/0 (dn):
local0 (dn):
tap0 (up):
  L3 10.10.1.1/24
tap1 (up): 
  unnumbered, use tap0
  L3 10.10.1.1/24

DBGvpp# sh ip punt redirect 
 rx tap0 redirect via 10.10.1.1 tap1

DBGvpp# sh ip arp 
    Time           IP4       Flags      Ethernet              Interface       
    477.3495   10.10.1.20      D    cc:cc:cc:cc:cc:cc tap0
     30.9754    10.10.1.1     SN    aa:aa:aa:aa:aa:aa tap1
Proxy arps enabled <span class="code-keyword">for</span>:
Fib_index 0   10.10.1.1 - 10.10.1.255

DBGvpp# sh hard
              Name                Idx   Link  Hardware
0: format_dpdk_device:594: rte_eth_dev_rss_hash_conf_get returned -95
GigabitEthernet0/8/0               1    down  GigabitEthernet0/8/0
  Link speed: 1 Gbps
  Ethernet address 08:00:27:d3:e3:ec
  Intel 82540EM (e1000)
    carrier up full duplex mtu 9206 
    flags: pmd maybe-multiseg tx-offload intel-phdr-cksum rx-ip4-cksum
    rx: queues 1 (max 1), desc 1024 (min 32 max 4096 align 8)
    tx: queues 1 (max 1), desc 1024 (min 32 max 4096 align 8)
    pci: device 8086:100f subsystem 15ad:0750 address 0000:00:08.00 numa 0
    module: unknown
    max rx packet len: 16128
    promiscuous: unicast off all-multicast off
    vlan offload: strip off filter off qinq off
    rx offload avail:  vlan-strip ipv4-cksum udp-cksum tcp-cksum [^udp-trace.txt]  vlan-filter 
                       jumbo-frame scatter keep-crc 
    rx offload active: ipv4-cksum jumbo-frame scatter 
    tx offload avail:  vlan-insert ipv4-cksum udp-cksum tcp-cksum multi-segs 
    tx offload active: udp-cksum tcp-cksum multi-segs 
    rss avail:         none
    rss active:        none
    tx burst function: eth_em_xmit_pkts
    rx burst function: eth_em_recv_pkts

local0                             0    down  local0
  Link speed: unknown
  local
tap0                               2     up   tap0
  Link speed: unknown
  Ethernet address dd:dd:dd:dd:dd:dd
  VIRTIO <span class="code-keyword">interface</span>
     instance 0
tap1                               3     up   tap1
  Link speed: unknown
  Ethernet address bb:bb:bb:bb:bb:bb
  VIRTIO <span class="code-keyword">interface</span>
     instance 1
</pre>
</div></div>
<p>Here is a snipped of packet trace of working TCP: <span class="nobr"><a href="https://jira.fd.io/secure/attachment/12408/12408_tcp-trace.txt" title="tcp-trace.txt attached to VPP-1696">tcp-trace.txt<sup><img class="rendericon" src="https://jira.fd.io/images/icons/link_attachment_7.gif" height="7" width="7" align="absmiddle" alt="" border="0"/></sup></a></span> <br/>
 And here is a packet trace of failing UDP: <span class="nobr"><a href="https://jira.fd.io/secure/attachment/12409/12409_udp-trace.txt" title="udp-trace.txt attached to VPP-1696">udp-trace.txt<sup><img class="rendericon" src="https://jira.fd.io/images/icons/link_attachment_7.gif" height="7" width="7" align="absmiddle" alt="" border="0"/></sup></a></span><br/>
 It seems that UDP packets do not get punted.</p>

<p>Note, to test the traffic I was using netcat:</p>
<div class="code panel" style="border-width: 1px;"><div class="codeContent panelContent">
<pre class="code-java">Container1:
$ nc -l -p 8080 &amp;
$ nc -u -l -p 9090 &amp;

Container2:
$ nc 10.10.1.1 8080 # OK
$ nc -u 10.10.1.1 9090 # FAIL
</pre>
</div></div>

<p>Thanks,<br/>
Milan</p>

**Comment by vvalderrv** [comment]
<p>nope, doesn't work.<br/>
 In order to test this thing, I do `<tt>nc -l 8080</tt>` inside container1 and `<tt>nc 10.10.1.1 8080</tt>` inside container2.<br/>
 VPP setup:</p>
<div class="preformatted panel" style="border-width: 1px;"><div class="preformattedContent panelContent">
<pre>vpp# sh int addr
GigabitEthernet0/19/0 (dn):
local0 (dn):
tap1 (up):
  unnumbered, use tap2
  L3 10.10.1.1/24
tap2 (up):
  L3 10.10.1.1/24
vpp#
</pre>
</div></div>
<p>VPP trace:</p>
<div class="preformatted panel" style="border-width: 1px;"><div class="preformattedContent panelContent">
<pre>------------------- Start of thread 0 vpp_main -------------------
Packet 1

00:14:52:915438: virtio-input
  virtio: hw_if_index 3 next-index 4 vring 0 len 74
    hdr: flags 0x00 gso_type 0x00 hdr_len 0 gso_size 0 csum_start 0 csum_offset 0 num_buffers 1
00:14:52:915445: ethernet-input
  IP4: 42:c4:fd:6d:1d:52 -&gt; 02:fe:17:5d:75:6b
00:14:52:915449: ip4-input
  TCP: 10.10.1.20 -&gt; 10.10.1.1
    tos 0x00, ttl 64, length 60, checksum 0xb23c
    fragment id 0x7257, flags DONT_FRAGMENT
  TCP: 51356 -&gt; 8080
    seq. 0x1f329aaf ack 0x00000000
    flags 0x02 SYN, tcp header: 40 bytes
    window 29200, checksum 0x12b6
00:14:52:915453: ip4-lookup
  fib 0 dpo-idx 5 flow hash: 0x00000000
  TCP: 10.10.1.20 -&gt; 10.10.1.1
    tos 0x00, ttl 64, length 60, checksum 0xb23c
    fragment id 0x7257, flags DONT_FRAGMENT
  TCP: 51356 -&gt; 8080
    seq. 0x1f329aaf ack 0x00000000
    flags 0x02 SYN, tcp header: 40 bytes
    window 29200, checksum 0x12b6
00:14:52:915455: ip4-local
    TCP: 10.10.1.20 -&gt; 10.10.1.1
      tos 0x00, ttl 64, length 60, checksum 0xb23c
      fragment id 0x7257, flags DONT_FRAGMENT
    TCP: 51356 -&gt; 8080
      seq. 0x1f329aaf ack 0x00000000
      flags 0x02 SYN, tcp header: 40 bytes
      window 29200, checksum 0x12b6
00:14:52:915459: ip4-punt
    TCP: 10.10.1.20 -&gt; 10.10.1.1
      tos 0x00, ttl 64, length 60, checksum 0xb23c
      fragment id 0x7257, flags DONT_FRAGMENT
    TCP: 51356 -&gt; 8080
      seq. 0x1f329aaf ack 0x00000000
      flags 0x02 SYN, tcp header: 40 bytes
      window 29200, checksum 0x12b6
00:14:52:915460: ip4-punt-redirect
  via 10.10.1.1 on tap2 using adj:1
00:14:52:915461: ip4-rewrite
  tx_sw_if_index 2 dpo-idx 1 : ipv4 via 10.10.1.1 tap2: mtu:9000 326f8eed1ed802fe6dc1f5810800 flow hash: 0x00000000
  00000000: 326f8eed1ed802fe6dc1f58108004500003c725740003f06b33c0a0a01140a0a
  00000020: 0101c89c1f901f329aaf00000000a002721012b60000020405b40402
00:14:52:915463: tap2-output
  tap2 l4-cksum-computed l4-cksum-correct l2_hdr_offset_valid l3_hdr_offset_valid 
  IP4: 02:fe:6d:c1:f5:81 -&gt; 32:6f:8e:ed:1e:d8
  TCP: 10.10.1.20 -&gt; 10.10.1.1
    tos 0x00, ttl 63, length 60, checksum 0xb33c
    fragment id 0x7257, flags DONT_FRAGMENT
  TCP: 51356 -&gt; 8080
    seq. 0x1f329aaf ack 0x00000000
    flags 0x02 SYN, tcp header: 40 bytes
    window 29200, checksum 0x12b6

Packet 2

00:14:52:915517: virtio-input
  virtio: hw_if_index 2 next-index 4 vring 0 len 42
    hdr: flags 0x00 gso_type 0x00 hdr_len 0 gso_size 0 csum_start 0 csum_offset 0 num_buffers 1
00:14:52:915517: ethernet-input
  ARP: 32:6f:8e:ed:1e:d8 -&gt; ff:ff:ff:ff:ff:ff
00:14:52:915518: arp-input
  request, type ethernet/IP4, address size 6/4
  32:6f:8e:ed:1e:d8/10.10.1.1 -&gt; 00:00:00:00:00:00/10.10.1.20
00:14:52:915524: error-drop
  rx:tap2
00:14:52:915525: drop
  arp-input: IP4 source address matches local interface</pre>
</div></div>
<p> </p>

**Comment by vvalderrv** [comment]
<p>ok got it.</p>

<p>try with VPP tap2 with 10.10.1.1/24 and tap1 unnumbered (to tap2).</p>

<p> </p>

**Comment by vvalderrv** [comment]
<p>Hi, <a href="https://jira.fd.io/secure/ViewProfile.jspa?name=nranns" class="user-hover" rel="nranns">Neale Ranns</a></p>


<p> Why does VPP's tap1 have the same IP address and subnet as container2's tap2?<br/>
 container2 does not have tap2 <img class="emoticon" src="https://jira.fd.io/images/icons/emoticons/smile.png" height="16" width="16" align="absmiddle" alt="" border="0"/> but anyway<br/>
 VPP tap1 is supposed to be a default gateway for the local network that container2 represents. But some of the packets that go to the default gateway (10.10.1.1) need to be punted from VPP towards the linux namespace of the container1 (via tap2). Therefore the tap2 IP address in the linux (container1) must be the same as VPP tap1.</p>


<p> IP address of the tap2 interface on VPP is not important, we just assigned some to put in into the l3 mode. It can be just unnumbered with IP of tap1.</p>

**Comment by vvalderrv** [comment]
<p>Hi,</p>

<p>can you explain your choice of addressing scheme please. why does VPP's tap1 have the same IP address and subnet as container2's tap2? Why is VPP's tap2 interface is a separate subnet?</p>

<p>thanks</p>

<p> </p>

<p> </p>

<p> </p>

**Comment by vvalderrv** [comment]
Jira Date Created: Tue, 4 Jun 2019 14:46:57 +0000
Jira Date Updated: Fri, 7 Jun 2019 07:52:25 +0000
