### ISSUE TITLE
[VPP-1283] NAT does not work in VPP 18.04 in some scenarios

### ISSUE THREAD

**Issue by vvalderrv** [FDio/vpp#2751]
### Description
ssh from a VM behind SNAT to an outside/external host fails in 18.04. It used to work in 18.01 and earlier.

 

The tcpdump on the outside/external host shows that the TCP connection establishment itself succeeds but then subsequent segments elicit an ICMP unreachable error msg from VPP side even though the segment sizes are well within the MTU on either side.

 

<blockquote>07:18:48.952331 IP 10.195.131.79.1826 > 10.195.69.200.22: Flags <span class="error">[S]</span>, seq 166103352, win 29200, options <span class="error">[mss 1460,sackOK,TS val 4448259 ecr 0,nop,wscale 6]</span>, length 0

07:18:48.952390 IP 10.195.69.200.22 > 10.195.131.79.1826: Flags <span class="error">[S.]</span>, seq 3294302182, ack 166103353, win 26960, options <span class="error">[mss 1360,sackOK,TS val 3514861845 ecr 4448259,nop,wscale 7]</span>, length 0

07:18:48.952581 IP 10.195.131.79.1826 > 10.195.69.200.22: Flags <span class="error">[.]</span>, ack 1, win 457, options <span class="error">[nop,nop,TS val 4448259 ecr 3514861845]</span>, length 0

07:18:48.952920 IP 10.195.131.79.1826 > 10.195.69.200.22: Flags <span class="error">[P.]</span>, seq 1:635, ack 1, win 457, options <span class="error">[nop,nop,TS val 4448260 ecr 3514861845]</span>, length 634

07:18:48.952937 IP 10.195.69.200.22 > 10.195.131.79.1826: Flags <span class="error">[.]</span>, ack 635, win 221, options <span class="error">[nop,nop,TS val 3514861845 ecr 4448260]</span>, length 0

07:18:48.957469 IP 10.195.69.200.22 > 10.195.131.79.1826: Flags <span class="error">[P.]</span>, seq 1:42, ack 635, win 221, options <span class="error">[nop,nop,TS val 3514861846 ecr 4448260]</span>, length 41

07:18:48.957599 IP 10.195.131.79.1826 > 10.195.69.200.22: Flags <span class="error">[.]</span>, ack 42, win 457, options <span class="error">[nop,nop,TS val 4448261 ecr 3514861846]</span>, length 0

<font color="#f6c342">07:18:48.957991 IP 10.195.69.200.22 > 10.195.131.79.1826: Flags <span class="error">[P.]</span>, seq 42:1690, ack 635, win 221, options <span class="error">[nop,nop,TS val 3514861846 ecr 4448261]</span>, length 1648</font>

<font color="#f6c342">07:18:48.958151 IP 10.195.131.79 > 10.195.69.200: ICMP 10.0.0.12 unreachable - need to frag, length 584</font>

<font color="#14892c">07:18:48.958621 IP 10.195.131.79.1826 > 10.195.69.200.22: Flags <span class="error">[.]</span>, ack 42, win 473, options <span class="error">[nop,nop,TS val 4448261 ecr 3514861846,nop,nop,sack 1 \{1390:1690}]</span>, length 0</font>

<font color="#14892c">07:18:48.962141 IP 10.195.69.200.22 > 10.195.131.79.1826: Flags <span class="error">[.]</span>, seq 42:1390, ack 635, win 221, options <span class="error">[nop,nop,TS val 3514861848 ecr 4448261]</span>, length 1348</font>

<font color="#14892c">07:18:48.962288 IP 10.195.131.79 > 10.195.69.200: ICMP 10.0.0.12 unreachable - need to frag, length 584</font>

<font color="#14892c">07:18:49.166141 IP 10.195.69.200.22 > 10.195.131.79.1826: Flags <span class="error">[.]</span>, seq 42:1390, ack 635, win 221, options <span class="error">[nop,nop,TS val 3514861899 ecr 4448261]</span>, length 1348</font>

<font color="#14892c">07:18:49.166278 IP 10.195.131.79 > 10.195.69.200: ICMP 10.0.0.12 unreachable - need to frag, length 584</font>

<font color="#14892c">07:18:49.574147 IP 10.195.69.200.22 > 10.195.131.79.1826: Flags <span class="error">[.]</span>, seq 42:1390, ack 635, win 221, options <span class="error">[nop,nop,TS val 3514862001 ecr 4448261]</span>, length 1348</font>

<font color="#14892c">07:18:49.574307 IP 10.195.131.79 > 10.195.69.200: ICMP 10.0.0.12 unreachable - need to frag, length 584</font>

<font color="#14892c">07:18:50.390146 IP 10.195.69.200.22 > 10.195.131.79.1826: Flags <span class="error">[.]</span>, seq 42:1390, ack 635, win 221, options <span class="error">[nop,nop,TS val 3514862205 ecr 4448261]</span>, length 1348</font>

<font color="#14892c">07:18:50.390306 IP 10.195.131.79 > 10.195.69.200: ICMP 10.0.0.12 unreachable - need to frag, length 584</font>

<font color="#14892c">07:18:52.026093 IP 10.195.69.200.22 > 10.195.131.79.1826: Flags <span class="error">[.]</span>, seq 42:1390, ack 635, win 221, options <span class="error">[nop,nop,TS val 3514862614 ecr 4448261]</span>, length 1348</font>

<font color="#14892c">07:18:52.026295 IP 10.195.131.79 > 10.195.69.200: ICMP 10.0.0.12 unreachable - need to frag, length 584</font>
</blockquote>

### Assignee
Ole Trøan

### Reporter
Onong Tayeng

### Comments
- **ot (Sun, 20 May 2018 07:43:33 +0000)**: How to Reproduce:

 

Create a namespace and veth pair:

 

<span class="error">[root@overcloud-controller-0 heat-admin]</span># ip netns add test

<span class="error">[root@overcloud-controller-0 heat-admin]</span># ip link add test0 type veth peer name test1

<span class="error">[root@overcloud-controller-0 heat-admin]</span># ip link set test1 up

<span class="error">[root@overcloud-controller-0 heat-admin]</span># ip link set test0 netns test

<span class="error">[root@overcloud-controller-0 heat-admin]</span># ip netns exec test ip link set test0 up

<span class="error">[root@overcloud-controller-0 heat-admin]</span># ip netns exec test ip addr add 10.0.0.55/16 dev test0

<span class="error">[root@overcloud-controller-0 heat-admin]</span># ip netns exec test ip route add default via 10.0.0.1

<span class="error">[root@overcloud-controller-0 heat-admin]</span># ip netns exec test ethtool -K test0 rx off tx off

 

Create plumbings in VPP to connect to veth, a bridge domain and a loopback BVI:

 

vpp# create host-interface name test1

host-test1

vpp# set int state host-test1 up

vpp# set int l2 bridge host-test1 999

vpp# create loopback interface

loop2

vpp# set int state loop2 up

vpp# set int ip address loop2 10.0.0.1/16

vpp# set int l2 bridge loop2 999 bvi

vpp# sh bridge-domain 999 detail

  BD-ID   Index   BSN  Age(min)  Learning  U-Forwrd  UU-Flood  Flooding  ARP-Term  BVI-Intf

   999      3      0     off        on        on        on        on       off      loop2

 

           Interface           If-idx ISN  SHG  BVI  TxFlood        VLAN-Tag-Rewrite

             loop2               8     1    0    *      *                 none

          host-test1             7     1    0    -      *                 none

vpp#

 

So, now you ought to be able to ping the BVI in VPP:

 

<span class="error">[root@overcloud-controller-0 heat-admin]</span># ip netns exec test ping 10.0.0.1

PING 10.0.0.1 (10.0.0.1) 56(84) bytes of data.

64 bytes from 10.0.0.1: icmp_seq=2 ttl=64 time=0.735 ms

64 bytes from 10.0.0.1: icmp_seq=3 ttl=64 time=0.128 ms

 

Create external bridge on the host system:

 

<span class="error">[root@overcloud-controller-0 heat-admin]</span># brctl addbr br-ex

<span class="error">[root@overcloud-controller-0 heat-admin]</span># brctl addif br-ex enp12s0  ç replace with external interface

 

Create tapv2 interface in VPP to connect to the external bridge:

 

create tap host-if-name vpp_ext_tap host-bridge br-ex rx-ring-size 1024 tx-ring-size 1024

set interface state tap0 up

 

So, now the bridge on the host system ought to look like this:

 

<span class="error">[root@overcloud-controller-0 heat-admin]</span># brctl show

br-ex           8000.0025b5aa0172       no              enp12s0

                                                        vpp_ext_tap

 

Add the tapv2 interface to a new bridge domain and add a BVI:

 

vpp# create loopback interface

loop0

vpp# set int state loop0 up

vpp# set int l2 bridge loop0 1000 bvi

vpp# set int ip address loop0 10.195.131.77/27  ç replace with an unused IP address from external network

 

vpp# set int l2 bridge tap0 1000

vpp# sh bridge-domain 1000 detail

  BD-ID   Index   BSN  Age(min)  Learning  U-Forwrd  UU-Flood  Flooding  ARP-Term  BVI-Intf

  1000      1      1      3         on        on        on        on       off      loop0

 

           Interface           If-idx ISN  SHG  BVI  TxFlood        VLAN-Tag-Rewrite

             loop0               5     3    0    *      *                 none

             tap0                2     3    0    -      *                 none

vpp#

 

 

Add a default route:

 

vpp# ip route add 0.0.0.0/0 via 10.195.131.94  ç replace with default gateway of your external network

ipv4-VRF:0, fib_index:0, flow hash:<span class="error">[src dst sport dport proto ]</span> locks:<span class="error">[src:plugin-hi:2, src:adjacency:2, src:default-route:1, ]</span>

0.0.0.0/0

  unicast-ip4-chain

  <span class="error">[@0]</span>: dpo-load-balance: [proto:ip4 index:1 buckets:1 uRPF:18 to:<span class="error">[17:2272]</span> via:<span class="error">[3:252]</span>]

    <span class="error">[0]</span> <span class="error">[@10]</span>: dpo-load-balance: [proto:ip4 index:14 buckets:1 uRPF:15 to:<span class="error">[0:0]</span>]

          <span class="error">[0]</span> <span class="error">[@5]</span>: ipv4 via 10.195.131.94 loop0: mtu:9000 78baf9adacc3dead000000000800

 

 

Configure SNAT:

 

vpp# set int nat44 in loop2 out loop0

vpp# nat44 add interface address loop0

 

vpp# sh nat44 interfaces

NAT44 interfaces:

loop2 in

loop0 out

vpp# sh nat44 addresses

NAT44 pool addresses:

10.195.131.77

  tenant VRF independent

  0 busy udp ports

  0 busy tcp ports

  0 busy icmp ports

NAT44 twice-nat pool addresses:

vpp#

 

 

Now we should be able to ping outside:

 

<span class="error">[root@overcloud-controller-0 heat-admin]</span># ip netns exec test ping 10.195.69.200

PING 10.195.69.200 (10.195.69.200) 56(84) bytes of data.

64 bytes from 10.195.69.200: icmp_seq=1 ttl=61 time=0.663 ms

64 bytes from 10.195.69.200: icmp_seq=2 ttl=61 time=0.338 ms

 

Now, set the MTU of loop2 to 1500:

 

vat# sw_interface_set_mtu sw_if_index 8 mtu 1500

vat#

 

Now, try ssh and we have the ICMP Unreachable msg:

 

06:31:58.921573 IP 10.195.131.77.23198 > 10.195.69.200.ssh: Flags <span class="error">[S]</span>, seq 2658118973, win 29200, options <span class="error">[mss 1460,sackOK,TS val 2561425471 ecr 0,nop,wscale 7]</span>, length 0

06:31:58.921745 IP 10.195.69.200.ssh > 10.195.131.77.23198: Flags <span class="error">[S.]</span>, seq 2834083626, ack 2658118974, win 26960, options <span class="error">[mss 1360,sackOK,TS val 3594259333 ecr 2561425471,nop,wscale 7]</span>, length 0

06:31:58.921987 IP 10.195.131.77.23198 > 10.195.69.200.ssh: Flags <span class="error">[.]</span>, ack 1, win 229, options <span class="error">[nop,nop,TS val 2561425471 ecr 3594259333]</span>, length 0

06:31:58.922491 IP 10.195.131.77.23198 > 10.195.69.200.ssh: Flags <span class="error">[P.]</span>, seq 1:22, ack 1, win 229, options <span class="error">[nop,nop,TS val 2561425472 ecr 3594259333]</span>, length 21

06:31:58.922538 IP 10.195.69.200.ssh > 10.195.131.77.23198: Flags <span class="error">[.]</span>, ack 22, win 211, options <span class="error">[nop,nop,TS val 3594259333 ecr 2561425472]</span>, length 0

06:31:58.927051 IP 10.195.69.200.ssh > 10.195.131.77.23198: Flags <span class="error">[P.]</span>, seq 1:42, ack 22, win 211, options <span class="error">[nop,nop,TS val 3594259335 ecr 2561425472]</span>, length 41

06:31:58.927136 IP 10.195.131.77.23198 > 10.195.69.200.ssh: Flags <span class="error">[.]</span>, ack 42, win 229, options <span class="error">[nop,nop,TS val 2561425477 ecr 3594259335]</span>, length 0

06:31:58.927356 IP 10.195.131.77.23198 > 10.195.69.200.ssh: Flags <span class="error">[.]</span>, seq 22:1370, ack 42, win 229, options <span class="error">[nop,nop,TS val 2561425477 ecr 3594259335]</span>, length 1348

06:31:58.927361 IP 10.195.131.77.23198 > 10.195.69.200.ssh: Flags <span class="error">[P.]</span>, seq 1370:1518, ack 42, win 229, options <span class="error">[nop,nop,TS val 2561425477 ecr 3594259335]</span>, length 148

06:31:58.927395 IP 10.195.69.200.ssh > 10.195.131.77.23198: Flags <span class="error">[.]</span>, ack 1518, win 234, options <span class="error">[nop,nop,TS val 3594259335 ecr 2561425477]</span>, length 0

06:31:58.927545 IP 10.195.69.200.ssh > 10.195.131.77.23198: Flags <span class="error">[P.]</span>, seq 42:1690, ack 1518, win 234, options <span class="error">[nop,nop,TS val 3594259335 ecr 2561425477]</span>, length 1648

06:31:58.927582 IP 10.195.131.77 > 10.195.69.200: ICMP 10.0.0.55 unreachable - need to frag (mtu 1284), length 556

06:31:58.927606 IP 10.195.131.77.23198 > 10.195.69.200.ssh: Flags <span class="error">[.]</span>, ack 42, win 237, options <span class="error">[nop,nop,TS val 2561425477 ecr 3594259335,nop,nop,sack 1 \{1390:1690}]</span>, length 0

06:31:58.930899 IP 10.195.69.200.ssh > 10.195.131.77.23198: Flags <span class="error">[.]</span>, seq 42:1390, ack 1518, win 234, options <span class="error">[nop,nop,TS val 3594259336 ecr 2561425477]</span>, length 1348

06:31:58.930962 IP 10.195.131.77 > 10.195.69.200: ICMP 10.0.0.55 unreachable - need to frag (mtu 1284), length 556

06:31:59.134912 IP 10.195.69.200.ssh > 10.195.131.77.23198: Flags <span class="error">[.]</span>, seq 42:1390, ack 1518, win 234, options <span class="error">[nop,nop,TS val 3594259387 ecr 2561425477]</span>, length 1348

06:31:59.135033 IP 10.195.131.77 > 10.195.69.200: ICMP 10.0.0.55 unreachable - need to frag (mtu 1284), length 556

06:31:59.542920 IP 10.195.69.200.ssh > 10.195.131.77.23198: Flags <span class="error">[.]</span>, seq 42:1390, ack 1518, win 234, options <span class="error">[nop,nop,TS val 3594259489 ecr 2561425477]</span>, length 1348

06:31:59.542989 IP 10.195.131.77 > 10.195.69.200: ICMP 10.0.0.55 unreachable - need to frag (mtu 1284), length 556
- **ot (Sun, 20 May 2018 07:42:28 +0000)**: Tried a patch from Ole and the issue happens albeit now we know the MTU value and the MTU value reported by VPP (1248 bytes) is different from the link MTU (1500 byes).

 

 

<blockquote>06:46:10.176062 IP 10.195.131.81.53893 > 10.195.69.200.22: Flags <span class="error">[S]</span>, seq 4251363385, win 29200, options <span class="error">[mss 1460,sackOK,TS val 4294935649 ecr 0,nop,wscale 6]</span>, length 0

06:46:10.176118 IP 10.195.69.200.22 > 10.195.131.81.53893: Flags <span class="error">[S.]</span>, seq 1615190617, ack 4251363386, win 26960, options <span class="error">[mss 1360,sackOK,TS val 3557572147 ecr 4294935649,nop,wscale 7]</span>, length 0

06:46:10.176257 IP 10.195.131.81.53893 > 10.195.69.200.22: Flags <span class="error">[.]</span>, ack 1, win 457, options <span class="error">[nop,nop,TS val 4294935650 ecr 3557572147]</span>, length 0

06:46:10.176651 IP 10.195.131.81.53893 > 10.195.69.200.22: Flags <span class="error">[P.]</span>, seq 1:635, ack 1, win 457, options <span class="error">[nop,nop,TS val 4294935650 ecr 3557572147]</span>, length 634

06:46:10.176668 IP 10.195.69.200.22 > 10.195.131.81.53893: Flags <span class="error">[.]</span>, ack 635, win 221, options <span class="error">[nop,nop,TS val 3557572147 ecr 4294935650]</span>, length 0

06:46:10.181388 IP 10.195.69.200.22 > 10.195.131.81.53893: Flags <span class="error">[P.]</span>, seq 1:42, ack 635, win 221, options <span class="error">[nop,nop,TS val 3557572148 ecr 4294935650]</span>, length 41

06:46:10.181552 IP 10.195.131.81.53893 > 10.195.69.200.22: Flags <span class="error">[.]</span>, ack 42, win 457, options <span class="error">[nop,nop,TS val 4294935651 ecr 3557572148]</span>, length 0

06:46:10.181946 IP 10.195.69.200.22 > 10.195.131.81.53893: Flags <span class="error">[P.]</span>, seq 42:1690, ack 635, win 221, options <span class="error">[nop,nop,TS val 3557572148 ecr 4294935651]</span>, length 1648

06:46:10.182061 IP 10.195.131.81 > 10.195.69.200: ICMP 10.0.0.11 unreachable - need to frag (mtu 1284), length 556

06:46:10.182574 IP 10.195.131.81.53893 > 10.195.69.200.22: Flags <span class="error">[.]</span>, ack 42, win 473, options <span class="error">[nop,nop,TS val 4294935651 ecr 3557572148,nop,nop,sack 1 \{1390:1690}]</span>, length 0

06:46:10.182770 IP 10.195.69.200.22 > 10.195.131.81.53893: Flags <span class="error">[.]</span>, seq 42:1390, ack 635, win 221, options <span class="error">[nop,nop,TS val 3557572149 ecr 4294935651]</span>, length 1348

06:46:10.182841 IP 10.195.131.81 > 10.195.69.200: ICMP 10.0.0.11 unreachable - need to frag (mtu 1284), length 556
</blockquote>

Original issue: https://jira.fd.io/browse/VPP-1283

**Comment by vvalderrv** [comment]
<p>How to Reproduce:</p>

<p> </p>

<p>Create a namespace and veth pair:</p>

<p> </p>

<p><span class="error">&#91;root@overcloud-controller-0 heat-admin&#93;</span># ip netns add test</p>

<p><span class="error">&#91;root@overcloud-controller-0 heat-admin&#93;</span># ip link add test0 type veth peer name test1</p>

<p><span class="error">&#91;root@overcloud-controller-0 heat-admin&#93;</span># ip link set test1 up</p>

<p><span class="error">&#91;root@overcloud-controller-0 heat-admin&#93;</span># ip link set test0 netns test</p>

<p><span class="error">&#91;root@overcloud-controller-0 heat-admin&#93;</span># ip netns exec test ip link set test0 up</p>

<p><span class="error">&#91;root@overcloud-controller-0 heat-admin&#93;</span># ip netns exec test ip addr add 10.0.0.55/16 dev test0</p>

<p><span class="error">&#91;root@overcloud-controller-0 heat-admin&#93;</span># ip netns exec test ip route add default via 10.0.0.1</p>

<p><span class="error">&#91;root@overcloud-controller-0 heat-admin&#93;</span># ip netns exec test ethtool -K test0 rx off tx off</p>

<p> </p>

<p>Create plumbings in VPP to connect to veth, a bridge domain and a loopback BVI:</p>

<p> </p>

<p>vpp# create host-interface name test1</p>

<p>host-test1</p>

<p>vpp# set int state host-test1 up</p>

<p>vpp# set int l2 bridge host-test1 999</p>

<p>vpp# create loopback interface</p>

<p>loop2</p>

<p>vpp# set int state loop2 up</p>

<p>vpp# set int ip address loop2 10.0.0.1/16</p>

<p>vpp# set int l2 bridge loop2 999 bvi</p>

<p>vpp# sh bridge-domain 999 detail</p>

<p>  BD-ID   Index   BSN  Age(min)  Learning  U-Forwrd  UU-Flood  Flooding  ARP-Term  BVI-Intf</p>

<p>   999      3      0     off        on        on        on        on       off      loop2</p>

<p> </p>

<p>           Interface           If-idx ISN  SHG  BVI  TxFlood        VLAN-Tag-Rewrite</p>

<p>             loop2               8     1    0    *      *                 none</p>

<p>          host-test1             7     1    0    -      *                 none</p>

<p>vpp#</p>

<p> </p>

<p>So, now you ought to be able to ping the BVI in VPP:</p>

<p> </p>

<p><span class="error">&#91;root@overcloud-controller-0 heat-admin&#93;</span># ip netns exec test ping 10.0.0.1</p>

<p>PING 10.0.0.1 (10.0.0.1) 56(84) bytes of data.</p>

<p>64 bytes from 10.0.0.1: icmp_seq=2 ttl=64 time=0.735 ms</p>

<p>64 bytes from 10.0.0.1: icmp_seq=3 ttl=64 time=0.128 ms</p>

<p> </p>

<p>Create external bridge on the host system:</p>

<p> </p>

<p><span class="error">&#91;root@overcloud-controller-0 heat-admin&#93;</span># brctl addbr br-ex</p>

<p><span class="error">&#91;root@overcloud-controller-0 heat-admin&#93;</span># brctl addif br-ex enp12s0  ç replace with external interface</p>

<p> </p>

<p>Create tapv2 interface in VPP to connect to the external bridge:</p>

<p> </p>

<p>create tap host-if-name vpp_ext_tap host-bridge br-ex rx-ring-size 1024 tx-ring-size 1024</p>

<p>set interface state tap0 up</p>

<p> </p>

<p>So, now the bridge on the host system ought to look like this:</p>

<p> </p>

<p><span class="error">&#91;root@overcloud-controller-0 heat-admin&#93;</span># brctl show</p>

<p>br-ex           8000.0025b5aa0172       no              enp12s0</p>

<p>                                                        vpp_ext_tap</p>

<p> </p>

<p>Add the tapv2 interface to a new bridge domain and add a BVI:</p>

<p> </p>

<p>vpp# create loopback interface</p>

<p>loop0</p>

<p>vpp# set int state loop0 up</p>

<p>vpp# set int l2 bridge loop0 1000 bvi</p>

<p>vpp# set int ip address loop0 10.195.131.77/27  ç replace with an unused IP address from external network</p>

<p> </p>

<p>vpp# set int l2 bridge tap0 1000</p>

<p>vpp# sh bridge-domain 1000 detail</p>

<p>  BD-ID   Index   BSN  Age(min)  Learning  U-Forwrd  UU-Flood  Flooding  ARP-Term  BVI-Intf</p>

<p>  1000      1      1      3         on        on        on        on       off      loop0</p>

<p> </p>

<p>           Interface           If-idx ISN  SHG  BVI  TxFlood        VLAN-Tag-Rewrite</p>

<p>             loop0               5     3    0    *      *                 none</p>

<p>             tap0                2     3    0    -      *                 none</p>

<p>vpp#</p>

<p> </p>

<p> </p>

<p>Add a default route:</p>

<p> </p>

<p>vpp# ip route add 0.0.0.0/0 via 10.195.131.94  ç replace with default gateway of your external network</p>

<p>ipv4-VRF:0, fib_index:0, flow hash:<span class="error">&#91;src dst sport dport proto &#93;</span> locks:<span class="error">&#91;src:plugin-hi:2, src:adjacency:2, src:default-route:1, &#93;</span></p>

<p>0.0.0.0/0</p>

<p>  unicast-ip4-chain</p>

<p>  <span class="error">&#91;@0&#93;</span>: dpo-load-balance: [proto:ip4 index:1 buckets:1 uRPF:18 to:<span class="error">&#91;17:2272&#93;</span> via:<span class="error">&#91;3:252&#93;</span>]</p>

<p>    <span class="error">&#91;0&#93;</span> <span class="error">&#91;@10&#93;</span>: dpo-load-balance: [proto:ip4 index:14 buckets:1 uRPF:15 to:<span class="error">&#91;0:0&#93;</span>]</p>

<p>          <span class="error">&#91;0&#93;</span> <span class="error">&#91;@5&#93;</span>: ipv4 via 10.195.131.94 loop0: mtu:9000 78baf9adacc3dead000000000800</p>

<p> </p>

<p> </p>

<p>Configure SNAT:</p>

<p> </p>

<p>vpp# set int nat44 in loop2 out loop0</p>

<p>vpp# nat44 add interface address loop0</p>

<p> </p>

<p>vpp# sh nat44 interfaces</p>

<p>NAT44 interfaces:</p>

<p>loop2 in</p>

<p>loop0 out</p>

<p>vpp# sh nat44 addresses</p>

<p>NAT44 pool addresses:</p>

<p>10.195.131.77</p>

<p>  tenant VRF independent</p>

<p>  0 busy udp ports</p>

<p>  0 busy tcp ports</p>

<p>  0 busy icmp ports</p>

<p>NAT44 twice-nat pool addresses:</p>

<p>vpp#</p>

<p> </p>

<p> </p>

<p>Now we should be able to ping outside:</p>

<p> </p>

<p><span class="error">&#91;root@overcloud-controller-0 heat-admin&#93;</span># ip netns exec test ping 10.195.69.200</p>

<p>PING 10.195.69.200 (10.195.69.200) 56(84) bytes of data.</p>

<p>64 bytes from 10.195.69.200: icmp_seq=1 ttl=61 time=0.663 ms</p>

<p>64 bytes from 10.195.69.200: icmp_seq=2 ttl=61 time=0.338 ms</p>

<p> </p>

<p>Now, set the MTU of loop2 to 1500:</p>

<p> </p>

<p>vat# sw_interface_set_mtu sw_if_index 8 mtu 1500</p>

<p>vat#</p>

<p> </p>

<p>Now, try ssh and we have the ICMP Unreachable msg:</p>

<p> </p>

<p>06:31:58.921573 IP 10.195.131.77.23198 &gt; 10.195.69.200.ssh: Flags <span class="error">&#91;S&#93;</span>, seq 2658118973, win 29200, options <span class="error">&#91;mss 1460,sackOK,TS val 2561425471 ecr 0,nop,wscale 7&#93;</span>, length 0</p>

<p>06:31:58.921745 IP 10.195.69.200.ssh &gt; 10.195.131.77.23198: Flags <span class="error">&#91;S.&#93;</span>, seq 2834083626, ack 2658118974, win 26960, options <span class="error">&#91;mss 1360,sackOK,TS val 3594259333 ecr 2561425471,nop,wscale 7&#93;</span>, length 0</p>

<p>06:31:58.921987 IP 10.195.131.77.23198 &gt; 10.195.69.200.ssh: Flags <span class="error">&#91;.&#93;</span>, ack 1, win 229, options <span class="error">&#91;nop,nop,TS val 2561425471 ecr 3594259333&#93;</span>, length 0</p>

<p>06:31:58.922491 IP 10.195.131.77.23198 &gt; 10.195.69.200.ssh: Flags <span class="error">&#91;P.&#93;</span>, seq 1:22, ack 1, win 229, options <span class="error">&#91;nop,nop,TS val 2561425472 ecr 3594259333&#93;</span>, length 21</p>

<p>06:31:58.922538 IP 10.195.69.200.ssh &gt; 10.195.131.77.23198: Flags <span class="error">&#91;.&#93;</span>, ack 22, win 211, options <span class="error">&#91;nop,nop,TS val 3594259333 ecr 2561425472&#93;</span>, length 0</p>

<p>06:31:58.927051 IP 10.195.69.200.ssh &gt; 10.195.131.77.23198: Flags <span class="error">&#91;P.&#93;</span>, seq 1:42, ack 22, win 211, options <span class="error">&#91;nop,nop,TS val 3594259335 ecr 2561425472&#93;</span>, length 41</p>

<p>06:31:58.927136 IP 10.195.131.77.23198 &gt; 10.195.69.200.ssh: Flags <span class="error">&#91;.&#93;</span>, ack 42, win 229, options <span class="error">&#91;nop,nop,TS val 2561425477 ecr 3594259335&#93;</span>, length 0</p>

<p>06:31:58.927356 IP 10.195.131.77.23198 &gt; 10.195.69.200.ssh: Flags <span class="error">&#91;.&#93;</span>, seq 22:1370, ack 42, win 229, options <span class="error">&#91;nop,nop,TS val 2561425477 ecr 3594259335&#93;</span>, length 1348</p>

<p>06:31:58.927361 IP 10.195.131.77.23198 &gt; 10.195.69.200.ssh: Flags <span class="error">&#91;P.&#93;</span>, seq 1370:1518, ack 42, win 229, options <span class="error">&#91;nop,nop,TS val 2561425477 ecr 3594259335&#93;</span>, length 148</p>

<p>06:31:58.927395 IP 10.195.69.200.ssh &gt; 10.195.131.77.23198: Flags <span class="error">&#91;.&#93;</span>, ack 1518, win 234, options <span class="error">&#91;nop,nop,TS val 3594259335 ecr 2561425477&#93;</span>, length 0</p>

<p>06:31:58.927545 IP 10.195.69.200.ssh &gt; 10.195.131.77.23198: Flags <span class="error">&#91;P.&#93;</span>, seq 42:1690, ack 1518, win 234, options <span class="error">&#91;nop,nop,TS val 3594259335 ecr 2561425477&#93;</span>, length 1648</p>

<p>06:31:58.927582 IP 10.195.131.77 &gt; 10.195.69.200: ICMP 10.0.0.55 unreachable - need to frag (mtu 1284), length 556</p>

<p>06:31:58.927606 IP 10.195.131.77.23198 &gt; 10.195.69.200.ssh: Flags <span class="error">&#91;.&#93;</span>, ack 42, win 237, options <span class="error">&#91;nop,nop,TS val 2561425477 ecr 3594259335,nop,nop,sack 1 \{1390:1690}&#93;</span>, length 0</p>

<p>06:31:58.930899 IP 10.195.69.200.ssh &gt; 10.195.131.77.23198: Flags <span class="error">&#91;.&#93;</span>, seq 42:1390, ack 1518, win 234, options <span class="error">&#91;nop,nop,TS val 3594259336 ecr 2561425477&#93;</span>, length 1348</p>

<p>06:31:58.930962 IP 10.195.131.77 &gt; 10.195.69.200: ICMP 10.0.0.55 unreachable - need to frag (mtu 1284), length 556</p>

<p>06:31:59.134912 IP 10.195.69.200.ssh &gt; 10.195.131.77.23198: Flags <span class="error">&#91;.&#93;</span>, seq 42:1390, ack 1518, win 234, options <span class="error">&#91;nop,nop,TS val 3594259387 ecr 2561425477&#93;</span>, length 1348</p>

<p>06:31:59.135033 IP 10.195.131.77 &gt; 10.195.69.200: ICMP 10.0.0.55 unreachable - need to frag (mtu 1284), length 556</p>

<p>06:31:59.542920 IP 10.195.69.200.ssh &gt; 10.195.131.77.23198: Flags <span class="error">&#91;.&#93;</span>, seq 42:1390, ack 1518, win 234, options <span class="error">&#91;nop,nop,TS val 3594259489 ecr 2561425477&#93;</span>, length 1348</p>

<p>06:31:59.542989 IP 10.195.131.77 &gt; 10.195.69.200: ICMP 10.0.0.55 unreachable - need to frag (mtu 1284), length 556</p>

**Comment by vvalderrv** [comment]
<p>Tried a patch from Ole and the issue happens albeit now we know the MTU value and the MTU value reported by VPP (1248 bytes) is different from the link MTU (1500 byes).</p>

<p> </p>

<p> </p>
<blockquote><p>06:46:10.176062 IP 10.195.131.81.53893 &gt; 10.195.69.200.22: Flags <span class="error">&#91;S&#93;</span>, seq 4251363385, win 29200, options <span class="error">&#91;mss 1460,sackOK,TS val 4294935649 ecr 0,nop,wscale 6&#93;</span>, length 0</p>

<p>06:46:10.176118 IP 10.195.69.200.22 &gt; 10.195.131.81.53893: Flags <span class="error">&#91;S.&#93;</span>, seq 1615190617, ack 4251363386, win 26960, options <span class="error">&#91;mss 1360,sackOK,TS val 3557572147 ecr 4294935649,nop,wscale 7&#93;</span>, length 0</p>

<p>06:46:10.176257 IP 10.195.131.81.53893 &gt; 10.195.69.200.22: Flags <span class="error">&#91;.&#93;</span>, ack 1, win 457, options <span class="error">&#91;nop,nop,TS val 4294935650 ecr 3557572147&#93;</span>, length 0</p>

<p>06:46:10.176651 IP 10.195.131.81.53893 &gt; 10.195.69.200.22: Flags <span class="error">&#91;P.&#93;</span>, seq 1:635, ack 1, win 457, options <span class="error">&#91;nop,nop,TS val 4294935650 ecr 3557572147&#93;</span>, length 634</p>

<p>06:46:10.176668 IP 10.195.69.200.22 &gt; 10.195.131.81.53893: Flags <span class="error">&#91;.&#93;</span>, ack 635, win 221, options <span class="error">&#91;nop,nop,TS val 3557572147 ecr 4294935650&#93;</span>, length 0</p>

<p>06:46:10.181388 IP 10.195.69.200.22 &gt; 10.195.131.81.53893: Flags <span class="error">&#91;P.&#93;</span>, seq 1:42, ack 635, win 221, options <span class="error">&#91;nop,nop,TS val 3557572148 ecr 4294935650&#93;</span>, length 41</p>

<p>06:46:10.181552 IP 10.195.131.81.53893 &gt; 10.195.69.200.22: Flags <span class="error">&#91;.&#93;</span>, ack 42, win 457, options <span class="error">&#91;nop,nop,TS val 4294935651 ecr 3557572148&#93;</span>, length 0</p>

<p>06:46:10.181946 IP 10.195.69.200.22 &gt; 10.195.131.81.53893: Flags <span class="error">&#91;P.&#93;</span>, seq 42:1690, ack 635, win 221, options <span class="error">&#91;nop,nop,TS val 3557572148 ecr 4294935651&#93;</span>, length 1648</p>

<p>06:46:10.182061 IP 10.195.131.81 &gt; 10.195.69.200: ICMP 10.0.0.11 unreachable - need to frag (mtu 1284), length 556</p>

<p>06:46:10.182574 IP 10.195.131.81.53893 &gt; 10.195.69.200.22: Flags <span class="error">&#91;.&#93;</span>, ack 42, win 473, options <span class="error">&#91;nop,nop,TS val 4294935651 ecr 3557572148,nop,nop,sack 1 \{1390:1690}&#93;</span>, length 0</p>

<p>06:46:10.182770 IP 10.195.69.200.22 &gt; 10.195.131.81.53893: Flags <span class="error">&#91;.&#93;</span>, seq 42:1390, ack 635, win 221, options <span class="error">&#91;nop,nop,TS val 3557572149 ecr 4294935651&#93;</span>, length 1348</p>

<p>06:46:10.182841 IP 10.195.131.81 &gt; 10.195.69.200: ICMP 10.0.0.11 unreachable - need to frag (mtu 1284), length 556</p></blockquote>
