### ISSUE TITLE
[VPP-1696] ARP reply is not working

### ISSUE THREAD

**Issue by vvalderrv** [FDio/vpp#843]
<p>Found the bug in VPP 19.04, but also was able to reproduce it with VPP 19.01.</p>

<p>ARP reply is not working if a static ARP entry has been created on VPP for the requested IP address pointing towards another interface. In the following setup, the issue is that ARP request comes to VPP, VPP trace says ARP reply sent, but it is not actually sent.</p>
<h2><a name="%C2%A0Setup"></a> Setup</h2>
<div class="preformatted panel" style="border-width: 1px;"><div class="preformattedContent panelContent">
<pre>+----------------------------------------------------+   +----------------+
|  +---------------------------+                     |   |                |
|  |                           |                     |   |                |
|  |            +--------+     |                     |   |  +--------+    |
|  |            |        |     |                     |   |  |        |    |
|  |            |  tap1  +----------------------------------+  tap1  |    |
|  |            |        |     |                     |   |  |        |    |
|  |            +--------+     |                     |   |  +--------+    |
|  |            10.10.1.1/24   |                     |   |  10.10.1.20/24 |
|  |                           |                     |   |                |
|  |            +--------+     |  +--------+         |   |                |
|  |            |        |     |  |        |         |   |                |
|  |            |  tap2  +--------+  tap2  |         |   |                |
|  |            |        |     |  |        |         |   |                |
|  |            +--------+     |  +--------+         |   |                |
|  |  VPP       10.10.10.10/24 |  10.10.1.1/24       |   |                |
|  |                           |  ca:30:a0:34:37:cd  |   |                |
|  +---------------------------+                     |   |                |
|                                                    |   |                |
| Container 1                                        |   |  Container 2   |
+----------------------------------------------------+   +----------------+</pre>
</div></div>
<ul>
	<li><span class="error">&#91;In Container 1&#93;</span> Create TAP1 and TAP 2. Add IP punt redirect</li>
</ul>

<div class="preformatted panel" style="border-width: 1px;"><div class="preformattedContent panelContent">
<pre>vppctl create tap id 1 host-if-name tap1
vppctl set int ip addr tap1 10.10.1.1/24
vppctl set int state tap1 up 

vppctl create tap id 2 host-if-name tap2
vppctl set int ip addr tap2 10.10.10.10/24
vppctl set int state tap2 up

vppctl ip punt redirect add rx tap1 via 10.10.1.1 tap2</pre>
</div></div>
<ul>
	<li><span class="error">&#91;In Container 1&#93;</span> Set ip address of the Linux side of TAP2</li>
</ul>

<div class="preformatted panel" style="border-width: 1px;"><div class="preformattedContent panelContent">
<pre>ip address add 10.10.1.1/24 dev tap2</pre>
</div></div>
<ul>
	<li><span class="error">&#91;In Container 1&#93;</span> Add ARP entry</li>
</ul>

<div class="preformatted panel" style="border-width: 1px;"><div class="preformattedContent panelContent">
<pre>vppctl set ip arp tap2 10.10.1.1 ca:30:a0:34:37:cd</pre>
</div></div>
<p><tt>ca:30:a0:34:37:cd</tt> is the MAC address of the Linux side of TAP2</p>
<ul>
	<li>Move the Linux side of TAP1 to another namespace (client container)</li>
	<li><span class="error">&#91;In Container 2&#93;</span> Set ip address of the Linux side of TAP1 and bring it up</li>
</ul>

<div class="preformatted panel" style="border-width: 1px;"><div class="preformattedContent panelContent">
<pre>ip address add 10.10.1.20/24 dev tap1
ip link set dev tap1 up</pre>
</div></div>
<h2><a name="Configurationaftersetup"></a>Configuration after setup</h2>
<ul class="alternate" type="square">
	<li>VPP in Container 1</li>
</ul>

<div class="preformatted panel" style="border-width: 1px;"><div class="preformattedContent panelContent">
<pre>vpp# show int addr
GigabitEthernet0/19/0 (dn):
local0 (dn):
tap1 (up):
    L3 10.10.1.1/24
tap2 (up):
    L3 10.10.10.10/24

vpp# show ip arp
Time           IP4       Flags      Ethernet              Interface
254.3595    10.10.1.1      D    ca:30:a0:34:37:cd tap2

vpp# show ip punt redirect
    rx tap1 redirect via 10.10.1.1 tap2
</pre>
</div></div>
<ul class="alternate" type="square">
	<li>Container 1</li>
</ul>

<div class="preformatted panel" style="border-width: 1px;"><div class="preformattedContent panelContent">
<pre>root@07e62ae5f36d:/# ip a
... skipped lines for brevity
3: tap2: &lt;BROADCAST,MULTICAST,UP,LOWER_UP&gt; mtu 1500 qdisc fq_codel state UNKNOWN group default qlen 1000
    link/ether ca:30:a0:34:37:cd brd ff:ff:ff:ff:ff:ff
    inet 10.10.1.1/24 scope global tap2
    valid_lft forever preferred_lft forever</pre>
</div></div>
<ul class="alternate" type="square">
	<li>Container 2</li>
</ul>

<div class="preformatted panel" style="border-width: 1px;"><div class="preformattedContent panelContent">
<pre>root@b18853f5f328:/# ip a
... skipped lines for brevity
2: tap1: &lt;BROADCAST,MULTICAST,UP,LOWER_UP&gt; mtu 1500 qdisc fq_codel state UNKNOWN group default qlen 1000
    link/ether 62:01:5e:32:b3:9c brd ff:ff:ff:ff:ff:ff
    inet 10.10.1.20/24 scope global tap1
    valid_lft forever preferred_lft forever</pre>
</div></div>
<h2><a name="Theissue"></a>The issue</h2>
<ul class="alternate" type="square">
	<li>Ping from Container 2</li>
</ul>

<div class="preformatted panel" style="border-width: 1px;"><div class="preformattedContent panelContent">
<pre>root@b18853f5f328:/# ping -c 1 10.10.1.1
PING 10.10.1.1 (10.10.1.1) 56(84) bytes of data.
From 10.10.1.20 icmp_seq=1 Destination Host Unreachable    

--- 10.10.1.1 ping statistics ---
1 packets transmitted, 0 received, +1 errors, 100% packet loss, time 0ms 

root@b18853f5f328:/# </pre>
</div></div>
<ul class="alternate" type="square">
	<li>Tcpdump in Container 2</li>
</ul>

<div class="preformatted panel" style="border-width: 1px;"><div class="preformattedContent panelContent">
<pre>root@b18853f5f328:/# tcpdump -i tap1 -v
tcpdump: listening on tap1, link-type EN10MB (Ethernet), capture size 262144 bytes
14:19:24.407699 ARP, Ethernet (len 6), IPv4 (len 4), Request who-has 10.10.1.1 tell 10.10.1.20, length 28
14:19:25.435430 ARP, Ethernet (len 6), IPv4 (len 4), Request who-has 10.10.1.1 tell 10.10.1.20, length 28
14:19:26.459430 ARP, Ethernet (len 6), IPv4 (len 4), Request who-has 10.10.1.1 tell 10.10.1.20, length 2</pre>
</div></div>
<ul class="alternate" type="square">
	<li>Trace in VPP</li>
</ul>

<div class="preformatted panel" style="border-width: 1px;"><div class="preformattedContent panelContent">
<pre>Packet 1

00:11:57:580131: virtio-input
virtio: hw_if_index 2 next-index 4 vring 0 len 42
    hdr: flags 0x00 gso_type 0x00 hdr_len 0 gso_size 0 csum_start 0 csum_offset 0 num_buffers 1
00:11:57:580148: ethernet-input
ARP: 62:01:5e:32:b3:9c -&gt; ff:ff:ff:ff:ff:ff
00:11:57:580159: arp-input
request, type ethernet/IP4, address size 6/4
62:01:5e:32:b3:9c/10.10.1.20 -&gt; 00:00:00:00:00:00/10.10.1.1
00:11:57:580170: error-drop
arp-input: ARP replies sent

Packet 2

00:11:58:608857: virtio-input
virtio: hw_if_index 2 next-index 4 vring 0 len 42
    hdr: flags 0x00 gso_type 0x00 hdr_len 0 gso_size 0 csum_start 0 csum_offset 0 num_buffers 1
00:11:58:608865: ethernet-input
ARP: 62:01:5e:32:b3:9c -&gt; ff:ff:ff:ff:ff:ff
00:11:58:608868: arp-input
request, type ethernet/IP4, address size 6/4
62:01:5e:32:b3:9c/10.10.1.20 -&gt; 00:00:00:00:00:00/10.10.1.1
00:11:58:608878: error-drop
arp-input: ARP replies sent

Packet 3

00:11:59:633814: virtio-input
virtio: hw_if_index 2 next-index 4 vring 0 len 42
    hdr: flags 0x00 gso_type 0x00 hdr_len 0 gso_size 0 csum_start 0 csum_offset 0 num_buffers 1
00:11:59:633820: ethernet-input
ARP: 62:01:5e:32:b3:9c -&gt; ff:ff:ff:ff:ff:ff
00:11:59:633824: arp-input
request, type ethernet/IP4, address size 6/4
62:01:5e:32:b3:9c/10.10.1.20 -&gt; 00:00:00:00:00:00/10.10.1.1
00:11:59:633835: error-drop
arp-input: ARP replies sent</pre>
</div></div>
<ul class="alternate" type="square">
	<li>Interfaces:</li>
</ul>

<div class="preformatted panel" style="border-width: 1px;"><div class="preformattedContent panelContent">
<pre>vpp# sh int
            Name               Idx    State  MTU (L3/IP4/IP6/MPLS)     Counter          Count     
GigabitEthernet0/19/0             1     down         9000/0/0/0     
local0                            0     down          0/0/0/0       
tap1                              2      up          9000/0/0/0     rx packets                     3
                                                                    rx bytes                     126
                                                                    drops                          3
tap2                              3      up          9000/0/0/0     
vpp# </pre>
</div></div>
<ul class="alternate" type="square">
	<li>Errors in VPP:</li>
</ul>

<div class="preformatted panel" style="border-width: 1px;"><div class="preformattedContent panelContent">
<pre>vpp# sh err
    Count                    Node                  Reason
        3                arp-input               ARP replies sent
vpp#</pre>
</div></div>
<p>Please note that there are no tx packets on the tap1 interface, and the ARP reply was not received by the Linux (tcpdump in Container2).</p>
