### ISSUE TITLE
[VPP-1804] MAP-T drops return packed when PSID/Len are non-default values

### ISSUE THREAD

**Issue by vvalderrv** [FDio/vpp#3267]
### Description
<p>OK.  Three hosts:

    1) VPP with two interfaces, one IPv4, one IPv6, configured for MAP-T

    2) Host1 on an IPv6 net

    3) Host2 on an IPv4 net</p>

<p>VPP                                                                      Host2

      TenGig 6/0/3                                                enp5s0f1

      10.255.30.1/24      <---------------->      10.255.30.100/24</p>

<p>TenGig 6/0/1                                                    ip addr add 10.255.30.100/24 dev enp5s0f1

2001:db8:10::1/64                                          ip link set enp5s0f1 up

    ^                                                                     ip route add 10.0.0.0/8 via 10.255.30.1 dev enp5s0f1</p>
<div class='table-wrap'>
<table class='confluenceTable'><tbody>
<tr>
</tr>
<tr>
</tr>
<tr>
</tr>
</tbody></table>
</div>

<p>    V

Host1

-------------

enp5s0f0

2001:db8:10::100/64</p>

<p>ip addr add 2001:db8:10::100/64 dev enp5s0f0

ip link set enp5s0f0 up

ip -6 route add default via 2001:db8:10::1 dev enp5s0f0</p>

<p>A packet is sent from Host2 port 8888 to Host1 port 10234.  VPP maps it from IPv4 to

IPv6, and sends it out the IPv6 interface. 

Host1 verifiably receives it.  A response packet from Host1 is sent back to Host2.

VPP receives it on 6/0/1, maps it, but then drops it.  It should be transmitted out

6/0/3 to Host2.</p>

<p>Note that, if the MAP-T configuration is allowed to use default PSID/Len of 0/0,

then the reverse packets are delivered correctly.</p>

<p>VPP's configuration via vppctl

--------------------

set interface ip address TenGigabitEthernet6/0/1 2001:db8:10::1/64

set interface state TenGigabitEthernet6/0/1 up

map interface TenGigabitEthernet6/0/1 map-t</p>

<p>set interface ip address TenGigabitEthernet6/0/3 10.255.30.1/24

set interface state TenGigabitEthernet6/0/3 up

map interface TenGigabitEthernet6/0/3 map-t</p>

map add domain ip4-pfx 10.255.10.0/24 ip6-pfx 2001:db8::/48 ip6-src 2001:db8:ffff::/64 ea-bits-len 8 psid-offset 6 psid-len 8

ip route add 2001:db8::/48 via 2001:db8:10::100 TenGigabitEthernet6/0/1

<p>Forward packet (Host2 port 888 --> Host1 port 10234)

-------------------------------------------------------

Packet 4</p>

<p>01:05:50:199108: dpdk-input

  TenGigabitEthernet6/0/3 rx queue 0

  buffer 0x8b94b: current data 0, length 74, buffer-pool 0, ref-count 1, totlen-nifb 0, trac\

e handle 0x3

                  ext-hdr-valid

                  l4-cksum-computed l4-cksum-correct

  PKT MBUF: port 3, nb_segs 1, pkt_len 74

    buf_len 2176, data_len 74, ol_flags 0x180, data_off 128, phys_addr 0xfc0e5340

    packet_type 0x191 l2_len 0 l3_len 0 outer_l2_len 0 outer_l3_len 0

    rss 0x0 fdir.hi 0x0 fdir.lo 0x0

    Packet Offload Flags

      PKT_RX_IP_CKSUM_GOOD (0x0080) IP cksum of RX pkt. is valid

      PKT_RX_L4_CKSUM_GOOD (0x0100) L4 cksum of RX pkt. is valid

    Packet Types

      RTE_PTYPE_L2_ETHER (0x0001) Ethernet packet

      RTE_PTYPE_L3_IPV4_EXT_UNKNOWN (0x0090) IPv4 packet with or without extension headers

      RTE_PTYPE_L4_TCP (0x0100) TCP packet

  IP4: 00:1e:67:c2:5b:37 -> 00:08:a2:0b:21:35

  TCP: 10.255.30.100 -> 10.255.10.100

    tos 0x00, ttl 64, length 60, checksum 0x41d2

    fragment id 0xba24, flags DONT_FRAGMENT

  TCP: 8888 -> 10234

    seq. 0xf27e4db7 ack 0x00000000

    flags 0x02 SYN, tcp header: 40 bytes

    window 29200, checksum 0xef59

01:05:50:199110: ethernet-input

  frame: flags 0x3, hw-if-index 4, sw-if-index 4

  IP4: 00:1e:67:c2:5b:37 -> 00:08:a2:0b:21:35

01:05:50:199111: ip4-input-no-checksum

  TCP: 10.255.30.100 -> 10.255.10.100

    tos 0x00, ttl 64, length 60, checksum 0x41d2

    fragment id 0xba24, flags DONT_FRAGMENT

  TCP: 8888 -> 10234

    seq. 0xf27e4db7 ack 0x00000000

    flags 0x02 SYN, tcp header: 40 bytes

    window 29200, checksum 0xef59

01:05:50:199112: ip4-lookup

  fib 0 dpo-idx 0 flow hash: 0x00000000

  TCP: 10.255.30.100 -> 10.255.10.100

    tos 0x00, ttl 64, length 60, checksum 0x41d2

    fragment id 0xba24, flags DONT_FRAGMENT

  TCP: 8888 -> 10234

    seq. 0xf27e4db7 ack 0x00000000

    flags 0x02 SYN, tcp header: 40 bytes

    window 29200, checksum 0xef59

01:05:50:199112: ip4-drop

    TCP: 10.255.30.100 -> 10.255.10.100

      tos 0x00, ttl 64, length 60, checksum 0x41d2

      fragment id 0xba24, flags DONT_FRAGMENT

    TCP: 8888 -> 10234

      seq. 0xf27e4db7 ack 0x00000000

      flags 0x02 SYN, tcp header: 40 bytes

      window 29200, checksum 0xef59

01:05:50:199112: error-drop

  rx:TenGigabitEthernet6/0/3

01:05:50:199113: drop

  ip4-sv-reassembly-feature: valid ip4 packets</p>

<p>Reverse packet (Host1 port 10234 ---> Host2 port 888)

---------------------------------------------------------

Packet 7</p>

<p>01:05:51:227604: dpdk-input

  TenGigabitEthernet6/0/1 rx queue 0

  buffer 0x98d6b: current data 0, length 75, buffer-pool 0, ref-count 1, totlen-nifb 0, trac\

e handle 0x6

                  ext-hdr-valid

                  l4-cksum-computed l4-cksum-correct

  PKT MBUF: port 1, nb_segs 1, pkt_len 75

    buf_len 2176, data_len 75, ol_flags 0x180, data_off 128, phys_addr 0xfbc35b40

    packet_type 0x1e1 l2_len 0 l3_len 0 outer_l2_len 0 outer_l3_len 0

    rss 0x0 fdir.hi 0x0 fdir.lo 0x0

    Packet Offload Flags

      PKT_RX_IP_CKSUM_GOOD (0x0080) IP cksum of RX pkt. is valid

      PKT_RX_L4_CKSUM_GOOD (0x0100) L4 cksum of RX pkt. is valid

    Packet Types

      RTE_PTYPE_L2_ETHER (0x0001) Ethernet packet

      RTE_PTYPE_L3_IPV6_EXT_UNKNOWN (0x00e0) IPv6 packet with or without extension headers

      RTE_PTYPE_L4_TCP (0x0100) TCP packet

  IP6: 00:1e:67:c2:3f:ae -> 00:08:a2:0b:21:33

  TCP: 2001:db8:0:64:0:aff:a64:0 -> 2001:db8:ffff:0:a:ff1e:6400:0

    tos 0x00, flow label 0x0, hop limit 64, payload length 21

  TCP: 10234 -> 8888

    seq. 0x00000000 ack 0x00000000

    flags 0x02 SYN, tcp header: 20 bytes

    window 8192, checksum 0x3fcd

01:05:51:227605: ethernet-input

  frame: flags 0x3, hw-if-index 2, sw-if-index 2

  IP6: 00:1e:67:c2:3f:ae -> 00:08:a2:0b:21:33

01:05:51:227606: ip6-input

  TCP: 2001:db8:0:64:0:aff:a64:0 -> 2001:db8:ffff:0:a:ff1e:6400:0

    tos 0x00, flow label 0x0, hop limit 64, payload length 21

  TCP: 10234 -> 8888

    seq. 0x00000000 ack 0x00000000

    flags 0x02 SYN, tcp header: 20 bytes

    window 8192, checksum 0x3fcd

01:05:51:227609: ip6-lookup

  fib 0 dpo-idx 1 flow hash: 0x00000000

  TCP: 2001:db8:0:64:0:aff:a64:0 -> 2001:db8:ffff:0:a:ff1e:6400:0

    tos 0x00, flow label 0x0, hop limit 64, payload length 21

  TCP: 10234 -> 8888

    seq. 0x00000000 ack 0x00000000

    flags 0x02 SYN, tcp header: 20 bytes

    window 8192, checksum 0x3fcd

01:05:51:227610: ip6-drop

    TCP: 2001:db8:0:64:0:aff:a64:0 -> 2001:db8:ffff:0:a:ff1e:6400:0

      tos 0x00, flow label 0x0, hop limit 64, payload length 21

    TCP: 10234 -> 8888

      seq. 0x00000000 ack 0x00000000

      flags 0x02 SYN, tcp header: 20 bytes

      window 8192, checksum 0x3fcd

01:05:51:227611: error-drop

  rx:TenGigabitEthernet6/0/1

01:05:51:227611: drop

  dpdk-input: no error</p>

<p>Various "show" commands from vppctl

-----------------------------------------

vpp# show int TenGigabitEthernet6/0/1 feat

Feature paths configured on TenGigabitEthernet6/0/1...</p>

<p>nsh-eth-output:

  none configured

nsh-output:

  none configured

mpls-output:

  none configured

mpls-input:

  mpls-not-enabled

arp:

  arp-disabled

ip6-drop:

  none configured

ip6-punt:

  none configured

ip6-local:

  none configured

ip6-output:

  none configured

ip6-multicast:

ip6-unicast:

  ip6-sv-reassembly-feature

  ip6-map-t

ip4-drop:

  none configured

ip4-punt:

  none configured

ip4-local:

  none configured

ip4-output:

  none configured

ip4-multicast:

  ip4-not-enabled

ip4-unicast:

  ip4-sv-reassembly-feature

  ip4-map-t

  ip4-not-enabled

l2-output-nonip:

  none configured

l2-input-nonip:

  none configured

l2-output-ip6:

  none configured

l2-input-ip6:

  none configured

l2-output-ip4:

  none configured

l2-input-ip4:

  none configured

ethernet-output:

  none configured

interface-output:

  none configured

device-input:

  none configured

l2-input:

  none configured

l2-output:

  none configured</p>

<p>vpp# show ip fib

ipv4-VRF:0, fib_index:0, flow hash:<span class="error">[src dst sport dport proto ]</span> locks:[src:plugin-hi:2, src:\

adjacency:1, src:default-route:1, ]

0.0.0.0/0

  unicast-ip4-chain

  <span class="error">[@0]</span>: dpo-load-balance: [proto:ip4 index:1 buckets:1 uRPF:0 to:<span class="error">[15:900]</span>]

    <span class="error">[0]</span> <span class="error">[@0]</span>: dpo-drop ip4

0.0.0.0/32

  unicast-ip4-chain

  <span class="error">[@0]</span>: dpo-load-balance: [proto:ip4 index:2 buckets:1 uRPF:1 to:<span class="error">[0:0]</span>]

    <span class="error">[0]</span> <span class="error">[@0]</span>: dpo-drop ip4

10.255.30.0/32

  unicast-ip4-chain

  <span class="error">[@0]</span>: dpo-load-balance: [proto:ip4 index:15 buckets:1 uRPF:18 to:<span class="error">[0:0]</span>]

    <span class="error">[0]</span> <span class="error">[@0]</span>: dpo-drop ip4

10.255.30.0/24

  unicast-ip4-chain

  <span class="error">[@0]</span>: dpo-load-balance: [proto:ip4 index:14 buckets:1 uRPF:17 to:<span class="error">[0:0]</span>]

    <span class="error">[0]</span> <span class="error">[@4]</span>: ipv4-glean: TenGigabitEthernet6/0/3: mtu:9000 ffffffffffff0008a20b21350806

10.255.30.1/32

  unicast-ip4-chain

  <span class="error">[@0]</span>: dpo-load-balance: [proto:ip4 index:17 buckets:1 uRPF:22 to:<span class="error">[0:0]</span>]

    <span class="error">[0]</span> <span class="error">[@2]</span>: dpo-receive: 10.255.30.1 on TenGigabitEthernet6/0/3

10.255.30.100/32

  unicast-ip4-chain

  <span class="error">[@0]</span>: dpo-load-balance: [proto:ip4 index:20 buckets:1 uRPF:24 to:<span class="error">[10:410]</span>]

    <span class="error">[0]</span> <span class="error">[@5]</span>: ipv4 via 10.255.30.100 TenGigabitEthernet6/0/3: mtu:9000 001e67c25b370008a20b2\

1350800

10.255.30.255/32

  unicast-ip4-chain

  <span class="error">[@0]</span>: dpo-load-balance: [proto:ip4 index:16 buckets:1 uRPF:20 to:<span class="error">[0:0]</span>]

    <span class="error">[0]</span> <span class="error">[@0]</span>: dpo-drop ip4

224.0.0.0/4

  unicast-ip4-chain

  <span class="error">[@0]</span>: dpo-load-balance: [proto:ip4 index:4 buckets:1 uRPF:3 to:<span class="error">[0:0]</span>]

    <span class="error">[0]</span> <span class="error">[@0]</span>: dpo-drop ip4

240.0.0.0/4

  unicast-ip4-chain

  <span class="error">[@0]</span>: dpo-load-balance: [proto:ip4 index:3 buckets:1 uRPF:2 to:<span class="error">[0:0]</span>]

    <span class="error">[0]</span> <span class="error">[@0]</span>: dpo-drop ip4

255.255.255.255/32

  unicast-ip4-chain

  <span class="error">[@0]</span>: dpo-load-balance: [proto:ip4 index:5 buckets:1 uRPF:4 to:<span class="error">[15370:5041360]</span>]

    <span class="error">[0]</span> <span class="error">[@0]</span>: dpo-drop ip4</p>

<p>vpp# show ip6 fib

ipv6-VRF:0, fib_index:0, flow hash:<span class="error">[src dst sport dport proto ]</span> locks:[src:plugin-hi:1, src:\

default-route:1, ]

::/0

  unicast-ip6-chain

  <span class="error">[@0]</span>: dpo-load-balance: [proto:ip6 index:6 buckets:1 uRPF:5 to:<span class="error">[276:25936]</span>]

    <span class="error">[0]</span> <span class="error">[@0]</span>: dpo-drop ip6

2001:db8::/48

  unicast-ip6-chain

  <span class="error">[@0]</span>: dpo-load-balance: [proto:ip6 index:19 buckets:1 uRPF:26 to:<span class="error">[85:6660]</span>]

    <span class="error">[0]</span> <span class="error">[@5]</span>: ipv6 via 2001:db8:10::100 TenGigabitEthernet6/0/1: mtu:9000 001e67c23fae0008a2\

0b213386dd

2001:db8:10::/64

  unicast-ip6-chain

  <span class="error">[@0]</span>: dpo-load-balance: [proto:ip6 index:12 buckets:1 uRPF:15 to:<span class="error">[0:0]</span>]

    <span class="error">[0]</span> <span class="error">[@4]</span>: ipv6-glean: TenGigabitEthernet6/0/1: mtu:9000 ffffffffffff0008a20b213386dd

2001:db8:10::1/128

  unicast-ip6-chain

  <span class="error">[@0]</span>: dpo-load-balance: [proto:ip6 index:13 buckets:1 uRPF:16 to:<span class="error">[23:2360]</span>]

    <span class="error">[0]</span> <span class="error">[@2]</span>: dpo-receive: 2001:db8:10::1 on TenGigabitEthernet6/0/1

2001:db8:10::100/128

  unicast-ip6-chain

  <span class="error">[@0]</span>: dpo-load-balance: [proto:ip6 index:21 buckets:1 uRPF:23 to:<span class="error">[22:2288]</span>]

    <span class="error">[0]</span> <span class="error">[@5]</span>: ipv6 via 2001:db8:10::100 TenGigabitEthernet6/0/1: mtu:9000 001e67c23fae0008a2\

0b213386dd

fe80::/10

  unicast-ip6-chain

  <span class="error">[@0]</span>: dpo-load-balance: [proto:ip6 index:7 buckets:1 uRPF:6 to:<span class="error">[0:0]</span>]

    <span class="error">[0]</span> <span class="error">[@14]</span>: ip6-link-local</p>

<p>vpp# show int TenGigabitEthernet6/0/3 addr

TenGigabitEthernet6/0/3 (up):

  L3 10.255.30.1/24</p>

<p>vpp# show int TenGigabitEthernet6/0/1 addr

TenGigabitEthernet6/0/1 (up):

  L3 2001:db8:10::1/64</p>

<p>This command was used to send a packet from Host2 to Host1:

curl --noproxy "*" -I -m 5 --local-port 8888 10.255.10.100:10234</p>

<p>This command was used to send a return packet:

send_ipv6.py 2001:db8:0:64:0:aff:a64:0 2001:db8:ffff:0:a:ff1e:6400:0 TCP 10234 8888</p>

<p>This is the "send_ipv6.py" hacky script:

------------------------------------------------------------</p>
<ol>
	- Usage examples:
	- python send_ipv6.py src_ipv6 dst_ipv6 protocol srcport dstport
	- python send_ipv6.py 2001:db8:0:64:0:a0a:a64:0 2001:db8:ffff:0:a:a1e:6400:0 TCP 10234
	<li>python send_ipv6.py 2001:db8:0:64:0:a0a:a64:0 2001:db8:ffff:0:a:a1e:6400:0 UDP 10234

import sys

from scapy.all import send, sr1, IPv6, ICMPv6EchoRequest

from scapy.layers.inet import TCP, UDP

SOURCE = sys.argv<span class="error">[1]</span>

DESTINATION = sys.argv<span class="error">[2]</span>

TYPE = sys.argv<span class="error">[3]</span>

SRCPORT = int(sys.argv<span class="error">[4]</span>)

DSTPORT = int(sys.argv<span class="error">[5]</span>)

def send_ipv6(src_ip, dst_ip, type, dstport, srcport):

    if type.lower() == 'tcp':

        sr1(IPv6(src=src_ip, dst=dst_ip) / TCP(sport=srcport, dport=dstport) / '1', verbose=True, timeout=3, retry= 3)

    elif type.lower() == 'udp':

        sr1(IPv6(src=src_ip, dst=dst_ip) / UDP(sport=srcport, dport=dstport) / '1', verbose=True, timeout=3, retry= 3)

    else:

        return 0

    print('Packet with src IP {} for dst IP {} and port {} has been sent').format(src_ip, dst_ip, dstport)

if _<em>name</em>_ == '_<em>main</em>_':

    send_ipv6(SOURCE, DESTINATION, TYPE, DSTPORT, SRCPORT)</li>
</ol>

--------------------------------------------

<p>And, yeah, had I written that, I wouldn't have reversed the args like that.

Or, write your own scapy hack.  fnord</p>

<p>Lots of detail here.  Hope I got it all right.

Bob is your uncle.  Epstien did commit suicide.</p>

### Assignee
Ole Trøan

### Reporter
Jon Loeliger

### Comments
- **jdl (Wed, 27 Nov 2019 21:54:45 +0000)**: Aw crap.  I pasted the wrong packets above.

Let's try these:

<p>Forward packet:

Packet 4</p>

<p>05:54:24:375190: dpdk-input

  TenGigabitEthernet6/0/3 rx queue 0

  buffer 0x8d85f: current data 0, length 74, buffer-pool 0, ref-count 1, totlen-nifb 0, trace handle 0x3

                  ext-hdr-valid

                  l4-cksum-computed l4-cksum-correct

  PKT MBUF: port 3, nb_segs 1, pkt_len 74

    buf_len 2176, data_len 74, ol_flags 0x180, data_off 128, phys_addr 0xfc161840

    packet_type 0x191 l2_len 0 l3_len 0 outer_l2_len 0 outer_l3_len 0

    rss 0x0 fdir.hi 0x0 fdir.lo 0x0

    Packet Offload Flags

      PKT_RX_IP_CKSUM_GOOD (0x0080) IP cksum of RX pkt. is valid

      PKT_RX_L4_CKSUM_GOOD (0x0100) L4 cksum of RX pkt. is valid

    Packet Types

      RTE_PTYPE_L2_ETHER (0x0001) Ethernet packet

      RTE_PTYPE_L3_IPV4_EXT_UNKNOWN (0x0090) IPv4 packet with or without extension headers

      RTE_PTYPE_L4_TCP (0x0100) TCP packet

  IP4: 00:1e:67:c2:5b:37 -> 00:08:a2:0b:21:35

  TCP: 10.255.30.100 -> 10.255.10.100

    tos 0x00, ttl 64, length 60, checksum 0xd2b1

    fragment id 0x2945, flags DONT_FRAGMENT

  TCP: 8888 -> 10234

    seq. 0x15a5e186 ack 0x00000000

    flags 0x02 SYN, tcp header: 40 bytes

    window 29200, checksum 0x6a16

05:54:24:375191: ethernet-input

  frame: flags 0x3, hw-if-index 4, sw-if-index 4

  IP4: 00:1e:67:c2:5b:37 -> 00:08:a2:0b:21:35

05:54:24:375192: ip4-input-no-checksum

  TCP: 10.255.30.100 -> 10.255.10.100

    tos 0x00, ttl 64, length 60, checksum 0xd2b1

    fragment id 0x2945, flags DONT_FRAGMENT

  TCP: 8888 -> 10234

    seq. 0x15a5e186 ack 0x00000000

    flags 0x02 SYN, tcp header: 40 bytes

    window 29200, checksum 0x6a16

05:54:24:375193: ip4-map-t

  MAP domain index: 0 L4 port: 10234

05:54:24:375194: ip6-lookup

  fib 0 dpo-idx 4 flow hash: 0x00000000

  TCP: 2001:db8:ffff:0:a:ff1e:6400:0 -> 2001:db8:0:6400:0:aff:a64:0

    tos 0x00, flow label 0x0, hop limit 64, payload length 40

  TCP: 8888 -> 10234

    seq. 0x15a5e186 ack 0x00000000

    flags 0x02 SYN, tcp header: 40 bytes

    window 29200, checksum 0x70dd

05:54:24:375196: ip6-rewrite

  tx_sw_if_index 2 adj-idx 4 : ipv6 via 2001:db8:10::100 TenGigabitEthernet6/0/1: mtu:9000 001e67c23fae0008a20b213386dd flow hash: 0x00000000

  00000000: 001e67c23fae0008a20b213386dd600000000028063f20010db8ffff0000000a

  00000020: ff1e6400000020010db80000640000000aff0a64000022b827fa15a5e1860000

  00000040: 0000a002721070dd0000020405b40402080a2270c8c300000000010303090000

  00000060: 000000000000000000000000000715a32cca1bd2fccd14331366c686

05:54:24:375198: TenGigabitEthernet6/0/1-output

  TenGigabitEthernet6/0/1

  IP6: 00:08:a2:0b:21:33 -> 00:1e:67:c2:3f:ae

  TCP: 2001:db8:ffff:0:a:ff1e:6400:0 -> 2001:db8:0:6400:0:aff:a64:0

    tos 0x00, flow label 0x0, hop limit 63, payload length 40

  TCP: 8888 -> 10234

    seq. 0x15a5e186 ack 0x00000000

    flags 0x02 SYN, tcp header: 40 bytes

    window 29200, checksum 0x70dd

05:54:24:375199: TenGigabitEthernet6/0/1-tx

  TenGigabitEthernet6/0/1 tx queue 0

  buffer 0x8d85f: current data -20, length 94, buffer-pool 0, ref-count 1, totlen-nifb 0, trace handle 0x3

                  ext-hdr-valid

                  l4-cksum-computed l4-cksum-correct l2-hdr-offset 0 l3-hdr-offset 14

  PKT MBUF: port 3, nb_segs 1, pkt_len 94

    buf_len 2176, data_len 94, ol_flags 0x180, data_off 108, phys_addr 0xfc161840

    packet_type 0x191 l2_len 0 l3_len 0 outer_l2_len 0 outer_l3_len 0

    rss 0x0 fdir.hi 0x0 fdir.lo 0x0

    Packet Offload Flags

      PKT_RX_IP_CKSUM_GOOD (0x0080) IP cksum of RX pkt. is valid

      PKT_RX_L4_CKSUM_GOOD (0x0100) L4 cksum of RX pkt. is valid

    Packet Types

      RTE_PTYPE_L2_ETHER (0x0001) Ethernet packet

      RTE_PTYPE_L3_IPV4_EXT_UNKNOWN (0x0090) IPv4 packet with or without extension headers

      RTE_PTYPE_L4_TCP (0x0100) TCP packet

  IP6: 00:08:a2:0b:21:33 -> 00:1e:67:c2:3f:ae

  TCP: 2001:db8:ffff:0:a:ff1e:6400:0 -> 2001:db8:0:6400:0:aff:a64:0

    tos 0x00, flow label 0x0, hop limit 63, payload length 40

  TCP: 8888 -> 10234

    seq. 0x15a5e186 ack 0x00000000

    flags 0x02 SYN, tcp header: 40 bytes

    window 29200, checksum 0x70dd</p>

<p>Reverse packet:

Packet 9</p>

<p>05:54:27:289536: dpdk-input

  TenGigabitEthernet6/0/1 rx queue 0

  buffer 0x9d09a: current data 0, length 86, buffer-pool 0, ref-count 1, totlen-nifb 0, trace handle 0x8

                  ext-hdr-valid

                  l4-cksum-computed l4-cksum-correct

  PKT MBUF: port 1, nb_segs 1, pkt_len 86

    buf_len 2176, data_len 86, ol_flags 0x180, data_off 128, phys_addr 0xfbd42700

    packet_type 0x5e1 l2_len 0 l3_len 0 outer_l2_len 0 outer_l3_len 0

    rss 0x0 fdir.hi 0x0 fdir.lo 0x0

    Packet Offload Flags

      PKT_RX_IP_CKSUM_GOOD (0x0080) IP cksum of RX pkt. is valid

      PKT_RX_L4_CKSUM_GOOD (0x0100) L4 cksum of RX pkt. is valid

    Packet Types

      RTE_PTYPE_L2_ETHER (0x0001) Ethernet packet

      RTE_PTYPE_L3_IPV6_EXT_UNKNOWN (0x00e0) IPv6 packet with or without extension headers

      RTE_PTYPE_L4_ICMP (0x0500) ICMP packet

  IP6: 00:1e:67:c0:e1:a1 -> 33:33:ff:00:00:01

  ICMP6: 2001:db8:10::100 -> ff02::1:ff00:1

    tos 0x00, flow label 0x0, hop limit 255, payload length 32

  ICMP neighbor_solicitation checksum 0x757c

    target address 2001:db8:10::1

05:54:27:289537: ethernet-input

  frame: flags 0x3, hw-if-index 2, sw-if-index 2

  IP6: 00:1e:67:c0:e1:a1 -> 33:33:ff:00:00:01

05:54:27:289538: ip6-input

  ICMP6: 2001:db8:10::100 -> ff02::1:ff00:1

    tos 0x00, flow label 0x0, hop limit 255, payload length 32

  ICMP neighbor_solicitation checksum 0x757c

    target address 2001:db8:10::1

05:54:27:289538: ip6-mfib-forward-lookup

  fib 0 entry 2

05:54:27:289540: ip6-mfib-forward-rpf

  entry 2 itf 2 flags Accept,

05:54:27:289542: ip6-replicate

  replicate: 0 via <span class="error">[@1]</span>: dpo-receive

05:54:27:289543: ip6-local

    ICMP6: 2001:db8:10::100 -> ff02::1:ff00:1

      tos 0x00, flow label 0x0, hop limit 255, payload length 32

    ICMP neighbor_solicitation checksum 0x757c

    target address 2001:db8:10::1

05:54:27:289545: ip6-icmp-input

  ICMP6: 2001:db8:10::100 -> ff02::1:ff00:1

    tos 0x00, flow label 0x0, hop limit 255, payload length 32

  ICMP neighbor_solicitation checksum 0x757c

    target address 2001:db8:10::1

05:54:27:289546: icmp6-neighbor-solicitation

  ICMP6: 2001:db8:10::100 -> ff02::1:ff00:1

    tos 0x00, flow label 0x0, hop limit 255, payload length 32

  ICMP neighbor_solicitation checksum 0x757c

    target address 2001:db8:10::1

05:54:27:289552: TenGigabitEthernet6/0/1-output

  TenGigabitEthernet6/0/1

  IP6: 00:08:a2:0b:21:33 -> 00:1e:67:c0:e1:a1

  ICMP6: 2001:db8:10::1 -> 2001:db8:10::100

    tos 0x00, flow label 0x0, hop limit 255, payload length 32

  ICMP neighbor_advertisement checksum 0xc7ff

    target address 2001:db8:10::1

05:54:27:289552: TenGigabitEthernet6/0/1-tx

  TenGigabitEthernet6/0/1 tx queue 0

  buffer 0x9d09a: current data 0, length 86, buffer-pool 0, ref-count 1, totlen-nifb 0, trace handle 0x8

                  ext-hdr-valid

                  l4-cksum-computed l4-cksum-correct l2-hdr-offset 0 l3-hdr-offset 14

  PKT MBUF: port 1, nb_segs 1, pkt_len 86

    buf_len 2176, data_len 86, ol_flags 0x180, data_off 128, phys_addr 0xfbd42700

    packet_type 0x5e1 l2_len 0 l3_len 0 outer_l2_len 0 outer_l3_len 0

    rss 0x0 fdir.hi 0x0 fdir.lo 0x0

    Packet Offload Flags

      PKT_RX_IP_CKSUM_GOOD (0x0080) IP cksum of RX pkt. is valid

      PKT_RX_L4_CKSUM_GOOD (0x0100) L4 cksum of RX pkt. is valid

    Packet Types

      RTE_PTYPE_L2_ETHER (0x0001) Ethernet packet

      RTE_PTYPE_L3_IPV6_EXT_UNKNOWN (0x00e0) IPv6 packet with or without extension headers

      RTE_PTYPE_L4_ICMP (0x0500) ICMP packet

  IP6: 00:08:a2:0b:21:33 -> 00:1e:67:c0:e1:a1

  ICMP6: 2001:db8:10::1 -> 2001:db8:10::100

    tos 0x00, flow label 0x0, hop limit 255, payload length 32

  ICMP neighbor_advertisement checksum 0xc7ff

    target address 2001:db8:10::1</p>

<p>And while we are here, here are tcpdumps showing the packets

at the interfaces:</p>

<p>Host2

---------

15:44:18.489190 STP 802.1s, Rapid STP, CIST Flags <span class="error">[Learn, Forward]</span>, length 134

15:44:18.771429 IP 10.255.30.100.8888 > 10.255.10.100.10234: Flags <span class="error">[S]</span>, seq 363192710, win 2\

9200, options <span class="error">[mss 1460,sackOK,TS val 577816771 ecr 0,nop,wscale 9]</span>, length 0

15:44:19.772086 IP 10.255.30.100.8888 > 10.255.10.100.10234: Flags <span class="error">[S]</span>, seq 363192710, win 2\

9200, options <span class="error">[mss 1460,sackOK,TS val 577817772 ecr 0,nop,wscale 9]</span>, length 0

15:44:20.487968 STP 802.1s, Rapid STP, CIST Flags <span class="error">[Learn, Forward]</span>, length 134

15:44:21.561424 IP 0.0.0.0.68 > 255.255.255.255.67: BOOTP/DHCP, Request from 00:25:90:5d:0e:\

00, length 300

15:44:21.776111 IP 10.255.30.100.8888 > 10.255.10.100.10234: Flags <span class="error">[S]</span>, seq 363192710, win 2\

9200, options <span class="error">[mss 1460,sackOK,TS val 577819776 ecr 0,nop,wscale 9]</span>, length 0

15:44:22.487994 STP 802.1s, Rapid STP, CIST Flags <span class="error">[Learn, Forward]</span>, length 134

15:44:23.776105 ARP, Request who-has 10.255.30.1 tell 10.255.30.100, length 28

15:44:23.776150 ARP, Reply 10.255.30.1 is-at 00:08:a2:0b:21:35, length 46

15:44:24.488106 STP 802.1s, Rapid STP, CIST Flags <span class="error">[Learn, Forward]</span>, length 134</p>

<p>Host1

-------

15:44:19.771916 IP6 2001:db8:ffff:0:a:ff1e:6400:0.8888 > 2001:db8:0:6400:0:aff:a64:0.10234: \

Flags <span class="error">[S]</span>, seq 363192710, win 29200, options [mss 1460,sackOK,TS val 577817772 ecr 0,nop,wsc\

ale 9], length 0

15:44:20.487801 STP 802.1s, Rapid STP, CIST Flags <span class="error">[Learn, Forward]</span>, length 134

15:44:21.690089 IP6 2001:db8:10::100 > ff02::1:ff00:1: ICMP6, neighbor solicitation, who has\

 2001:db8:10::1, length 32

15:44:21.692305 IP6 2001:db8:10::1 > 2001:db8:10::100: ICMP6, neighbor advertisement, tgt is\

 2001:db8:10::1, length 32

15:44:21.699967 IP6 2001:db8:0:64:0:aff:a64:0.10234 > 2001:db8:ffff:0:a:ff1e:6400:0.8888: Fl\

ags <span class="error">[S]</span>, seq 0:1, win 8192, length 1

15:44:21.775903 IP6 2001:db8:ffff:0:a:ff1e:6400:0.8888 > 2001:db8:0:6400:0:aff:a64:0.10234: \

Flags <span class="error">[S]</span>, seq 363192710, win 29200, options [mss 1460,sackOK,TS val 577819776 ecr 0,nop,wsc\

ale 9], length 0

15:44:22.487831 STP 802.1s, Rapid STP, CIST Flags <span class="error">[Learn, Forward]</span>, length 134

15:44:24.487940 STP 802.1s, Rapid STP, CIST Flags <span class="error">[Learn, Forward]</span>, length 134

15:44:24.716628 IP6 2001:db8:0:64:0:aff:a64:0.10234 > 2001:db8:ffff:0:a:ff1e:6400:0.8888: Fl\

ags <span class="error">[S]</span>, seq 0:1, win 8192, length 1

15:44:26.487862 STP 802.1s, Rapid STP, CIST Flags <span class="error">[Learn, Forward]</span>, length 134

15:44:27.741795 IP6 2001:db8:0:64:0:aff:a64:0.10234 > 2001:db8:ffff:0:a:ff1e:6400:0.8888: Fl\

ags <span class="error">[S]</span>, seq 0:1, win 8192, length 1

15:44:28.487914 STP 802.1s, Rapid STP, CIST Flags <span class="error">[Learn, Forward]</span>, length 134

15:44:29.953593 IP6 fe80::21e:67ff:fea4:c4fc > ff02::1:ff0b:2132: ICMP6, neighbor solicitati\

on, who has fe80::208:a2ff:fe0b:2132, length 32

15:44:30.159978 CDPv2, ttl: 180s, Device-ID 'dell8024-10g-test-1', length 86

15:44:30.487954 STP 802.1s, Rapid STP, CIST Flags <span class="error">[Learn, Forward]</span>, length 134

15:44:30.756605 IP6 2001:db8:0:64:0:aff:a64:0.10234 > 2001:db8:ffff:0:a:ff1e:6400:0.8888: Fl\

ags <span class="error">[S]</span>, seq 0:1, win 8192, length 1

15:44:32.487982 STP 802.1s, Rapid STP, CIST Flags <span class="error">[Learn, Forward]</span>, length 134</p>

Bob is still your uncle.

Original issue: https://jira.fd.io/browse/VPP-1804

**Comment by vvalderrv** [comment]
<p>Aw crap.  I pasted the wrong packets above.</p>

<p>Let's try these:</p>

<p>Forward packet:<br/>
Packet 4</p>

<p>05:54:24:375190: dpdk-input<br/>
  TenGigabitEthernet6/0/3 rx queue 0<br/>
  buffer 0x8d85f: current data 0, length 74, buffer-pool 0, ref-count 1, totlen-nifb 0, trace handle 0x3<br/>
                  ext-hdr-valid<br/>
                  l4-cksum-computed l4-cksum-correct<br/>
  PKT MBUF: port 3, nb_segs 1, pkt_len 74<br/>
    buf_len 2176, data_len 74, ol_flags 0x180, data_off 128, phys_addr 0xfc161840<br/>
    packet_type 0x191 l2_len 0 l3_len 0 outer_l2_len 0 outer_l3_len 0<br/>
    rss 0x0 fdir.hi 0x0 fdir.lo 0x0<br/>
    Packet Offload Flags<br/>
      PKT_RX_IP_CKSUM_GOOD (0x0080) IP cksum of RX pkt. is valid<br/>
      PKT_RX_L4_CKSUM_GOOD (0x0100) L4 cksum of RX pkt. is valid<br/>
    Packet Types<br/>
      RTE_PTYPE_L2_ETHER (0x0001) Ethernet packet<br/>
      RTE_PTYPE_L3_IPV4_EXT_UNKNOWN (0x0090) IPv4 packet with or without extension headers<br/>
      RTE_PTYPE_L4_TCP (0x0100) TCP packet<br/>
  IP4: 00:1e:67:c2:5b:37 -&gt; 00:08:a2:0b:21:35<br/>
  TCP: 10.255.30.100 -&gt; 10.255.10.100<br/>
    tos 0x00, ttl 64, length 60, checksum 0xd2b1<br/>
    fragment id 0x2945, flags DONT_FRAGMENT<br/>
  TCP: 8888 -&gt; 10234<br/>
    seq. 0x15a5e186 ack 0x00000000<br/>
    flags 0x02 SYN, tcp header: 40 bytes<br/>
    window 29200, checksum 0x6a16<br/>
05:54:24:375191: ethernet-input<br/>
  frame: flags 0x3, hw-if-index 4, sw-if-index 4<br/>
  IP4: 00:1e:67:c2:5b:37 -&gt; 00:08:a2:0b:21:35<br/>
05:54:24:375192: ip4-input-no-checksum<br/>
  TCP: 10.255.30.100 -&gt; 10.255.10.100<br/>
    tos 0x00, ttl 64, length 60, checksum 0xd2b1<br/>
    fragment id 0x2945, flags DONT_FRAGMENT<br/>
  TCP: 8888 -&gt; 10234<br/>
    seq. 0x15a5e186 ack 0x00000000<br/>
    flags 0x02 SYN, tcp header: 40 bytes<br/>
    window 29200, checksum 0x6a16<br/>
05:54:24:375193: ip4-map-t<br/>
  MAP domain index: 0 L4 port: 10234<br/>
05:54:24:375194: ip6-lookup<br/>
  fib 0 dpo-idx 4 flow hash: 0x00000000<br/>
  TCP: 2001:db8:ffff:0:a:ff1e:6400:0 -&gt; 2001:db8:0:6400:0:aff:a64:0<br/>
    tos 0x00, flow label 0x0, hop limit 64, payload length 40<br/>
  TCP: 8888 -&gt; 10234<br/>
    seq. 0x15a5e186 ack 0x00000000<br/>
    flags 0x02 SYN, tcp header: 40 bytes<br/>
    window 29200, checksum 0x70dd<br/>
05:54:24:375196: ip6-rewrite<br/>
  tx_sw_if_index 2 adj-idx 4 : ipv6 via 2001:db8:10::100 TenGigabitEthernet6/0/1: mtu:9000 001e67c23fae0008a20b213386dd flow hash: 0x00000000<br/>
  00000000: 001e67c23fae0008a20b213386dd600000000028063f20010db8ffff0000000a<br/>
  00000020: ff1e6400000020010db80000640000000aff0a64000022b827fa15a5e1860000<br/>
  00000040: 0000a002721070dd0000020405b40402080a2270c8c300000000010303090000<br/>
  00000060: 000000000000000000000000000715a32cca1bd2fccd14331366c686<br/>
05:54:24:375198: TenGigabitEthernet6/0/1-output<br/>
  TenGigabitEthernet6/0/1<br/>
  IP6: 00:08:a2:0b:21:33 -&gt; 00:1e:67:c2:3f:ae<br/>
  TCP: 2001:db8:ffff:0:a:ff1e:6400:0 -&gt; 2001:db8:0:6400:0:aff:a64:0<br/>
    tos 0x00, flow label 0x0, hop limit 63, payload length 40<br/>
  TCP: 8888 -&gt; 10234<br/>
    seq. 0x15a5e186 ack 0x00000000<br/>
    flags 0x02 SYN, tcp header: 40 bytes<br/>
    window 29200, checksum 0x70dd<br/>
05:54:24:375199: TenGigabitEthernet6/0/1-tx<br/>
  TenGigabitEthernet6/0/1 tx queue 0<br/>
  buffer 0x8d85f: current data -20, length 94, buffer-pool 0, ref-count 1, totlen-nifb 0, trace handle 0x3<br/>
                  ext-hdr-valid<br/>
                  l4-cksum-computed l4-cksum-correct l2-hdr-offset 0 l3-hdr-offset 14<br/>
  PKT MBUF: port 3, nb_segs 1, pkt_len 94<br/>
    buf_len 2176, data_len 94, ol_flags 0x180, data_off 108, phys_addr 0xfc161840<br/>
    packet_type 0x191 l2_len 0 l3_len 0 outer_l2_len 0 outer_l3_len 0<br/>
    rss 0x0 fdir.hi 0x0 fdir.lo 0x0<br/>
    Packet Offload Flags<br/>
      PKT_RX_IP_CKSUM_GOOD (0x0080) IP cksum of RX pkt. is valid<br/>
      PKT_RX_L4_CKSUM_GOOD (0x0100) L4 cksum of RX pkt. is valid<br/>
    Packet Types<br/>
      RTE_PTYPE_L2_ETHER (0x0001) Ethernet packet<br/>
      RTE_PTYPE_L3_IPV4_EXT_UNKNOWN (0x0090) IPv4 packet with or without extension headers<br/>
      RTE_PTYPE_L4_TCP (0x0100) TCP packet<br/>
  IP6: 00:08:a2:0b:21:33 -&gt; 00:1e:67:c2:3f:ae<br/>
  TCP: 2001:db8:ffff:0:a:ff1e:6400:0 -&gt; 2001:db8:0:6400:0:aff:a64:0<br/>
    tos 0x00, flow label 0x0, hop limit 63, payload length 40<br/>
  TCP: 8888 -&gt; 10234<br/>
    seq. 0x15a5e186 ack 0x00000000<br/>
    flags 0x02 SYN, tcp header: 40 bytes<br/>
    window 29200, checksum 0x70dd</p>


<p>Reverse packet:<br/>
Packet 9</p>

<p>05:54:27:289536: dpdk-input<br/>
  TenGigabitEthernet6/0/1 rx queue 0<br/>
  buffer 0x9d09a: current data 0, length 86, buffer-pool 0, ref-count 1, totlen-nifb 0, trace handle 0x8<br/>
                  ext-hdr-valid<br/>
                  l4-cksum-computed l4-cksum-correct<br/>
  PKT MBUF: port 1, nb_segs 1, pkt_len 86<br/>
    buf_len 2176, data_len 86, ol_flags 0x180, data_off 128, phys_addr 0xfbd42700<br/>
    packet_type 0x5e1 l2_len 0 l3_len 0 outer_l2_len 0 outer_l3_len 0<br/>
    rss 0x0 fdir.hi 0x0 fdir.lo 0x0<br/>
    Packet Offload Flags<br/>
      PKT_RX_IP_CKSUM_GOOD (0x0080) IP cksum of RX pkt. is valid<br/>
      PKT_RX_L4_CKSUM_GOOD (0x0100) L4 cksum of RX pkt. is valid<br/>
    Packet Types<br/>
      RTE_PTYPE_L2_ETHER (0x0001) Ethernet packet<br/>
      RTE_PTYPE_L3_IPV6_EXT_UNKNOWN (0x00e0) IPv6 packet with or without extension headers<br/>
      RTE_PTYPE_L4_ICMP (0x0500) ICMP packet<br/>
  IP6: 00:1e:67:c0:e1:a1 -&gt; 33:33:ff:00:00:01<br/>
  ICMP6: 2001:db8:10::100 -&gt; ff02::1:ff00:1<br/>
    tos 0x00, flow label 0x0, hop limit 255, payload length 32<br/>
  ICMP neighbor_solicitation checksum 0x757c<br/>
    target address 2001:db8:10::1<br/>
05:54:27:289537: ethernet-input<br/>
  frame: flags 0x3, hw-if-index 2, sw-if-index 2<br/>
  IP6: 00:1e:67:c0:e1:a1 -&gt; 33:33:ff:00:00:01<br/>
05:54:27:289538: ip6-input<br/>
  ICMP6: 2001:db8:10::100 -&gt; ff02::1:ff00:1<br/>
    tos 0x00, flow label 0x0, hop limit 255, payload length 32<br/>
  ICMP neighbor_solicitation checksum 0x757c<br/>
    target address 2001:db8:10::1<br/>
05:54:27:289538: ip6-mfib-forward-lookup<br/>
  fib 0 entry 2<br/>
05:54:27:289540: ip6-mfib-forward-rpf<br/>
  entry 2 itf 2 flags Accept,<br/>
05:54:27:289542: ip6-replicate<br/>
  replicate: 0 via <span class="error">&#91;@1&#93;</span>: dpo-receive<br/>
05:54:27:289543: ip6-local<br/>
    ICMP6: 2001:db8:10::100 -&gt; ff02::1:ff00:1<br/>
      tos 0x00, flow label 0x0, hop limit 255, payload length 32<br/>
    ICMP neighbor_solicitation checksum 0x757c<br/>
    target address 2001:db8:10::1<br/>
05:54:27:289545: ip6-icmp-input<br/>
  ICMP6: 2001:db8:10::100 -&gt; ff02::1:ff00:1<br/>
    tos 0x00, flow label 0x0, hop limit 255, payload length 32<br/>
  ICMP neighbor_solicitation checksum 0x757c<br/>
    target address 2001:db8:10::1<br/>
05:54:27:289546: icmp6-neighbor-solicitation<br/>
  ICMP6: 2001:db8:10::100 -&gt; ff02::1:ff00:1<br/>
    tos 0x00, flow label 0x0, hop limit 255, payload length 32<br/>
  ICMP neighbor_solicitation checksum 0x757c<br/>
    target address 2001:db8:10::1<br/>
05:54:27:289552: TenGigabitEthernet6/0/1-output<br/>
  TenGigabitEthernet6/0/1<br/>
  IP6: 00:08:a2:0b:21:33 -&gt; 00:1e:67:c0:e1:a1<br/>
  ICMP6: 2001:db8:10::1 -&gt; 2001:db8:10::100<br/>
    tos 0x00, flow label 0x0, hop limit 255, payload length 32<br/>
  ICMP neighbor_advertisement checksum 0xc7ff<br/>
    target address 2001:db8:10::1<br/>
05:54:27:289552: TenGigabitEthernet6/0/1-tx<br/>
  TenGigabitEthernet6/0/1 tx queue 0<br/>
  buffer 0x9d09a: current data 0, length 86, buffer-pool 0, ref-count 1, totlen-nifb 0, trace handle 0x8<br/>
                  ext-hdr-valid<br/>
                  l4-cksum-computed l4-cksum-correct l2-hdr-offset 0 l3-hdr-offset 14<br/>
  PKT MBUF: port 1, nb_segs 1, pkt_len 86<br/>
    buf_len 2176, data_len 86, ol_flags 0x180, data_off 128, phys_addr 0xfbd42700<br/>
    packet_type 0x5e1 l2_len 0 l3_len 0 outer_l2_len 0 outer_l3_len 0<br/>
    rss 0x0 fdir.hi 0x0 fdir.lo 0x0<br/>
    Packet Offload Flags<br/>
      PKT_RX_IP_CKSUM_GOOD (0x0080) IP cksum of RX pkt. is valid<br/>
      PKT_RX_L4_CKSUM_GOOD (0x0100) L4 cksum of RX pkt. is valid<br/>
    Packet Types<br/>
      RTE_PTYPE_L2_ETHER (0x0001) Ethernet packet<br/>
      RTE_PTYPE_L3_IPV6_EXT_UNKNOWN (0x00e0) IPv6 packet with or without extension headers<br/>
      RTE_PTYPE_L4_ICMP (0x0500) ICMP packet<br/>
  IP6: 00:08:a2:0b:21:33 -&gt; 00:1e:67:c0:e1:a1<br/>
  ICMP6: 2001:db8:10::1 -&gt; 2001:db8:10::100<br/>
    tos 0x00, flow label 0x0, hop limit 255, payload length 32<br/>
  ICMP neighbor_advertisement checksum 0xc7ff<br/>
    target address 2001:db8:10::1</p>


<p>And while we are here, here are tcpdumps showing the packets<br/>
at the interfaces:</p>

<p>Host2<br/>
---------<br/>
15:44:18.489190 STP 802.1s, Rapid STP, CIST Flags <span class="error">&#91;Learn, Forward&#93;</span>, length 134<br/>
15:44:18.771429 IP 10.255.30.100.8888 &gt; 10.255.10.100.10234: Flags <span class="error">&#91;S&#93;</span>, seq 363192710, win 2\<br/>
9200, options <span class="error">&#91;mss 1460,sackOK,TS val 577816771 ecr 0,nop,wscale 9&#93;</span>, length 0<br/>
15:44:19.772086 IP 10.255.30.100.8888 &gt; 10.255.10.100.10234: Flags <span class="error">&#91;S&#93;</span>, seq 363192710, win 2\<br/>
9200, options <span class="error">&#91;mss 1460,sackOK,TS val 577817772 ecr 0,nop,wscale 9&#93;</span>, length 0<br/>
15:44:20.487968 STP 802.1s, Rapid STP, CIST Flags <span class="error">&#91;Learn, Forward&#93;</span>, length 134<br/>
15:44:21.561424 IP 0.0.0.0.68 &gt; 255.255.255.255.67: BOOTP/DHCP, Request from 00:25:90:5d:0e:\<br/>
00, length 300<br/>
15:44:21.776111 IP 10.255.30.100.8888 &gt; 10.255.10.100.10234: Flags <span class="error">&#91;S&#93;</span>, seq 363192710, win 2\<br/>
9200, options <span class="error">&#91;mss 1460,sackOK,TS val 577819776 ecr 0,nop,wscale 9&#93;</span>, length 0<br/>
15:44:22.487994 STP 802.1s, Rapid STP, CIST Flags <span class="error">&#91;Learn, Forward&#93;</span>, length 134<br/>
15:44:23.776105 ARP, Request who-has 10.255.30.1 tell 10.255.30.100, length 28<br/>
15:44:23.776150 ARP, Reply 10.255.30.1 is-at 00:08:a2:0b:21:35, length 46<br/>
15:44:24.488106 STP 802.1s, Rapid STP, CIST Flags <span class="error">&#91;Learn, Forward&#93;</span>, length 134</p>


<p>Host1<br/>
-------<br/>
15:44:19.771916 IP6 2001:db8:ffff:0:a:ff1e:6400:0.8888 &gt; 2001:db8:0:6400:0:aff:a64:0.10234: \<br/>
Flags <span class="error">&#91;S&#93;</span>, seq 363192710, win 29200, options [mss 1460,sackOK,TS val 577817772 ecr 0,nop,wsc\<br/>
ale 9], length 0<br/>
15:44:20.487801 STP 802.1s, Rapid STP, CIST Flags <span class="error">&#91;Learn, Forward&#93;</span>, length 134<br/>
15:44:21.690089 IP6 2001:db8:10::100 &gt; ff02::1:ff00:1: ICMP6, neighbor solicitation, who has\<br/>
 2001:db8:10::1, length 32<br/>
15:44:21.692305 IP6 2001:db8:10::1 &gt; 2001:db8:10::100: ICMP6, neighbor advertisement, tgt is\<br/>
 2001:db8:10::1, length 32<br/>
15:44:21.699967 IP6 2001:db8:0:64:0:aff:a64:0.10234 &gt; 2001:db8:ffff:0:a:ff1e:6400:0.8888: Fl\<br/>
ags <span class="error">&#91;S&#93;</span>, seq 0:1, win 8192, length 1<br/>
15:44:21.775903 IP6 2001:db8:ffff:0:a:ff1e:6400:0.8888 &gt; 2001:db8:0:6400:0:aff:a64:0.10234: \<br/>
Flags <span class="error">&#91;S&#93;</span>, seq 363192710, win 29200, options [mss 1460,sackOK,TS val 577819776 ecr 0,nop,wsc\<br/>
ale 9], length 0<br/>
15:44:22.487831 STP 802.1s, Rapid STP, CIST Flags <span class="error">&#91;Learn, Forward&#93;</span>, length 134<br/>
15:44:24.487940 STP 802.1s, Rapid STP, CIST Flags <span class="error">&#91;Learn, Forward&#93;</span>, length 134<br/>
15:44:24.716628 IP6 2001:db8:0:64:0:aff:a64:0.10234 &gt; 2001:db8:ffff:0:a:ff1e:6400:0.8888: Fl\<br/>
ags <span class="error">&#91;S&#93;</span>, seq 0:1, win 8192, length 1<br/>
15:44:26.487862 STP 802.1s, Rapid STP, CIST Flags <span class="error">&#91;Learn, Forward&#93;</span>, length 134<br/>
15:44:27.741795 IP6 2001:db8:0:64:0:aff:a64:0.10234 &gt; 2001:db8:ffff:0:a:ff1e:6400:0.8888: Fl\<br/>
ags <span class="error">&#91;S&#93;</span>, seq 0:1, win 8192, length 1<br/>
15:44:28.487914 STP 802.1s, Rapid STP, CIST Flags <span class="error">&#91;Learn, Forward&#93;</span>, length 134<br/>
15:44:29.953593 IP6 fe80::21e:67ff:fea4:c4fc &gt; ff02::1:ff0b:2132: ICMP6, neighbor solicitati\<br/>
on, who has fe80::208:a2ff:fe0b:2132, length 32<br/>
15:44:30.159978 CDPv2, ttl: 180s, Device-ID 'dell8024-10g-test-1', length 86<br/>
15:44:30.487954 STP 802.1s, Rapid STP, CIST Flags <span class="error">&#91;Learn, Forward&#93;</span>, length 134<br/>
15:44:30.756605 IP6 2001:db8:0:64:0:aff:a64:0.10234 &gt; 2001:db8:ffff:0:a:ff1e:6400:0.8888: Fl\<br/>
ags <span class="error">&#91;S&#93;</span>, seq 0:1, win 8192, length 1<br/>
15:44:32.487982 STP 802.1s, Rapid STP, CIST Flags <span class="error">&#91;Learn, Forward&#93;</span>, length 134</p>


<p>Bob is still your uncle.</p>

**Comment by vvalderrv** [comment]
Jira Date Created: Wed, 27 Nov 2019 21:16:40 +0000
Jira Date Updated: Thu, 13 Jun 2024 14:23:04 +0000
