### ISSUE TITLE
[VPP-2007] Unable to configure mixed NAT and non-NAT traffic

### ISSUE THREAD

**Issue by vvalderrv** [FDio/vpp#3469]
### Description
Hi all,

I am trying to setup mixed NAT and non-NAT traffic.

In GNS3 I created VPP VM with three interfaces (1 external, 2 internal).

<p>External interface GigabitEthernet0/5/0 with public IP address 203.0.113.1/30 connected to host with IP 203.0.113.2/30 and route to 198.51.100.0/24 via 203.0.113.1

 Internal interface GigabitEthernet0/6/0 with private IP address 172.16.0.1/24 connected to host with IP 172.16.0.2/24

 Internal interface GigabitEthernet0/7/0 with public IP address 198.51.100.1/25 connected to host with IP 198.51.100.2/25</p>

<p>Internal traffic from/to 198.51.100.0/25 should be forwarded without NAT.

 NAT address 198.51.100.128 should be applied on external interface only for internal traffic from 172.16.0.0/24.</p>

Here my setup for VPP 21.01.1 (running on CentOS 8)

/etc/vpp/startup.conf:

<div class="code panel" style="border-width: 1px;"><div class="codeContent panelContent">
<pre class="code-java">unix {
 nodaemon
 startup-config /etc/vpp/startup-config
 log /<span class="code-keyword">var</span>/log/vpp/vpp.log
 full-coredump
 cli-listen /run/vpp/cli.sock
 cli-history-limit 100
 cli-no-banner
 poll-sleep-usec 10
 gid vpp
}
api-trace {
 on
}
api-segment {
 gid vpp
}
dpdk {
 dev 0000:00:05.0
 dev 0000:00:06.0
 dev 0000:00:07.0
}
plugins {
 plugin <span class="code-keyword">default</span> { disable }
 plugin dpdk_plugin.so { enable }
 plugin nat_plugin.so { enable }
 plugin arping_plugin.so { enable }
 plugin ping_plugin.so { enable }
}
logging {
 <span class="code-keyword">default</span>-log-level debug
 <span class="code-keyword">default</span>-syslog-log-level debug
}
ethernet {
 <span class="code-keyword">default</span>-mtu 1500
}
</pre>
</div></div>
/etc/vpp/startup-config:

<div class="code panel" style="border-width: 1px;"><div class="codeContent panelContent">
<pre class="code-java">set <span class="code-keyword">interface</span> state GigabitEthernet0/5/0 up
set <span class="code-keyword">interface</span> state GigabitEthernet0/6/0 up
set <span class="code-keyword">interface</span> state GigabitEthernet0/7/0 up
set <span class="code-keyword">interface</span> ip address GigabitEthernet0/5/0 203.0.113.1/30
set <span class="code-keyword">interface</span> ip address GigabitEthernet0/6/0 172.16.0.1/24
set <span class="code-keyword">interface</span> ip address GigabitEthernet0/7/0 198.51.100.1/25
nat44 enable sessions 50000 endpoint-dependent
nat44 forwarding enable
nat44 add address 198.51.100.128
set <span class="code-keyword">interface</span> nat44 in GigabitEthernet0/6/0 output-feature
set <span class="code-keyword">interface</span> nat44 out GigabitEthernet0/5/0 output-feature
</pre>
</div></div>
If I run ping from internal host 172.16.0.2 to external host 203.0.113.2 then translation works correctly (tcpdump output on external host)

<div class="code panel" style="border-width: 1px;"><div class="codeContent panelContent">
<pre class="code-java">02:44:23.420497 IP 198.51.100.128 > 203.0.113.2: ICMP echo request, id 64233, seq 4, length 64
02:44:23.420516 IP 203.0.113.2 > 198.51.100.128: ICMP echo reply, id 64233, seq 4, length 64</pre>
</div></div>
But if I run ping 203.0.113.2 from internal host 198.51.100.2 then NAT also applied even though I didn't set nat in on the interface GigabitEthernet0/7/0

<div class="code panel" style="border-width: 1px;"><div class="codeContent panelContent">
<pre class="code-java">02:47:15.242598 IP 198.51.100.128 > 203.0.113.2: ICMP echo request, id 22324, seq 127, length 64
02:47:15.242620 IP 203.0.113.2 > 198.51.100.128: ICMP echo reply, id 22324, seq 127, length 64
</pre>
</div></div>
<div class="code panel" style="border-width: 1px;"><div class="codeContent panelContent">
<pre class="code-java">vpp# show nat44 interfaces
NAT44 interfaces:
 GigabitEthernet0/6/0 output-feature in
 GigabitEthernet0/5/0 output-feature out
</pre>
</div></div>
 If I remove "output-feature" then translation not applied at all with enabled "nat44 forwarding enable".

 

In setup for VPP 21.10 I removed "endpoint-dependent" but if "output-feature" will stay on internal interface GigabitEthernet0/6/0 I see new problem.

Only one correct response received on internal host 172.16.0.2 when running ping 203.0.113.2, second response comes with source IP 198.51.100.128 instead of 203.0.113.2 (tcpdump on internal host)

<div class="code panel" style="border-width: 1px;"><div class="codeContent panelContent">
<pre class="code-java">03:06:18.420787 IP 172.16.0.2 > 203.0.113.2: ICMP echo request, id 405, seq 1, length 64
03:06:18.427246 IP 203.0.113.2 > 172.16.0.2: ICMP echo reply, id 405, seq 1, length 64
03:06:19.424157 IP 172.16.0.2 > 203.0.113.2: ICMP echo request, id 405, seq 2, length 64
03:06:19.424441 IP 198.51.100.128 > 172.16.0.2: ICMP echo reply, id 59651, seq 2, length 64
</pre>
</div></div>
So I removed "output-feature" from internal interface GigabitEthernet0/6/0

/etc/vpp/startup-config:

<div class="code panel" style="border-width: 1px;"><div class="codeContent panelContent">
<pre class="code-java">set <span class="code-keyword">interface</span> state GigabitEthernet0/5/0 up
set <span class="code-keyword">interface</span> state GigabitEthernet0/6/0 up
set <span class="code-keyword">interface</span> state GigabitEthernet0/7/0 up
set <span class="code-keyword">interface</span> ip address GigabitEthernet0/5/0 203.0.113.1/30
set <span class="code-keyword">interface</span> ip address GigabitEthernet0/6/0 172.16.0.1/24
set <span class="code-keyword">interface</span> ip address GigabitEthernet0/7/0 198.51.100.1/25
nat44 enable sessions 50000
nat44 forwarding enable
nat44 add address 198.51.100.128
set <span class="code-keyword">interface</span> nat44 in GigabitEthernet0/6/0
set <span class="code-keyword">interface</span> nat44 out GigabitEthernet0/5/0 output-feature</pre>
</div></div>
<div class="code panel" style="border-width: 1px;"><div class="codeContent panelContent">
<pre class="code-java">vpp# show nat44 interfaces  
NAT44 interfaces:
 GigabitEthernet0/6/0 in
 GigabitEthernet0/5/0 output-feature in out
</pre>
</div></div>
With this setup in VPP 21.10 NAT also applied to both subnets 172.16.0.0/24 and 198.51.100.0/25.

Can someone, please, check is this bug or error in my configuration?

### Assignee
Filip Varga

### Reporter
nucleo

### Comments
- **fivarga89 (Fri, 28 Jan 2022 18:03:14 +0000)**: Hi, ofc. you can freely request such a feature here on fd.io public Jira and through the mailing list. I would suggest creating a new ticket with the exact specification of what you are requesting.

 

c) I kind of figured that out.

At this point, it is hard to cleanly implement such a feature. It wasn't accounted for at the beginning. There are some features that partially allow you to pass traffic as you are trying to achieve but only for specific hosts. Not per subnet or per the whole interface. You could try different flavours of NAT in the /src/plugins/nat directory. For example policy nat PNAT.

NAT is still going through heavy development. Past two years we have cleaned, refactored and improved a lot of code in the /src/plugins/nat directory.  Basically what I am trying to say is that at some point NAT44-ED plugin may be generic enough to implement/add this feature at its core.
- **JIRAUSER14804 (Fri, 28 Jan 2022 00:34:01 +0000)**: Hi Filip,

<p>c) Gb6 -> Gb7 (no idea here ??)

Traffic just forwarded between two internal networks.</p>

Can this bug be changed to a New feature/Improvement or no plans to implement such feature?
- **fivarga89 (Fri, 28 Jan 2022 00:10:36 +0000)**: This is not a bug. It is a request for a feature/functionality not supported by the current nat44-ed plugin.
- **fivarga89 (Fri, 28 Jan 2022 00:09:18 +0000)**: Basically what I got from your configuration is:

GigabitEthernet0/5/0 203.0.113.1/30 (public)

GigabitEthernet0/7/0 198.51.100.1/25 (public)

GigabitEthernet0/6/0 172.16.0.1/24 (private)

What exactly is for you external interface ... I would guess GigabitEthernet0/5/0.

Communication between

a) Gb6 -> G5 should be mangled by NAT using NAT address

b) Gb5 -> Gb7 and Gb7 -> Gb5 no mangle - no NAT

c) Gb6 -> Gb7 (no idea here ??)

Forwarding feature

	- is used in conjunction with static mappings when you want to do only translations for the static mappings and pass the rest of the traffic without mangling it.
	- this is not applicable in your scenario if you are trying to achieve PAT aka dynamic NAT.

If a device is configured as an OUTPUT nat device all ingress traffic will get dropped. Usually, the OUTPUT device is the public-connected interface (WAN port).

 

If a device is configured as an INSIDE nat device all ingress traffic will get translated - will create a dynamic session.

 

Basically what you should use is :

<p>set interface nat44 out GigabitEthernet0/5/0

set interface nat44 in GigabitEthernet0/6/0</p>

Though any other traffic will get dropped. This is the starting point to find your solution.

The problem here is that any ingress communication on GigabitEthernet0/5/0 will get dropped by the nat44-ed-out2in-slowpath node because there is no session created for this traffic.

What you are looking for is a bypass for traffic this is not supported at this moment by the nat44-ed plugin.
- **fivarga89 (Thu, 27 Jan 2022 01:38:54 +0000)**: If you have a scenario where you want to nat only traffic from specific LAN interfaces you should not use output-feature. You should go with manually configuring inside and outside nat interfaces.

IFACE0 (LAN)

IFACE1 (LAN) (inside interface)

IFACE3 (WAN) (output-feature)

IFACE4 (WAN) (outside interface)

IFACE0 -> IFACE3 traffic get's translated after ip4-lookup node.

  - basically, all traffic entering the IFACE3 interface because of FIB table/routing will get translated and use one of the configured NAT IP addresses.

 IFACE1 -> IFACE4 or ANY

 - basically, all traffic entering the IFACE1 interface gets translated, doesn't matter what's the outside interface.

IFACE4, IFACE3 -> ANY

 - all traffic coming back from WAN will get translated based on the existing session.

 

forwarding:

 - misconception of how it should be used. forwarding is used with inside nat interface, not output-feature.

I would also suggest the most recent release of NAT. If not even master. NAT is undergoing heavy changes in the control and data plane.

I have recently changed the configuration of the output feature and its workings. (MASTER branch)

I will look into the issue and try to reproduce it.

Original issue: https://jira.fd.io/browse/VPP-2007

**Comment by vvalderrv** [comment]
<p>Hi, ofc. you can freely request such a feature here on fd.io public Jira and through the mailing list. I would suggest creating a new ticket with the exact specification of what you are requesting.</p>

<p> </p>

<p>c) I kind of figured that out.</p>

<p>At this point, it is hard to cleanly implement such a feature. It wasn't accounted for at the beginning. There are some features that partially allow you to pass traffic as you are trying to achieve but only for specific hosts. Not per subnet or per the whole interface. You could try different flavours of NAT in the /src/plugins/nat directory. For example policy nat PNAT.</p>

<p>NAT is still going through heavy development. Past two years we have cleaned, refactored and improved a lot of code in the /src/plugins/nat directory.  Basically what I am trying to say is that at some point NAT44-ED plugin may be generic enough to implement/add this feature at its core. </p>

**Comment by vvalderrv** [comment]
<p>Hi Filip,</p>

<p>c) Gb6 -&gt; Gb7 (no idea here ??)<br/>
Traffic just forwarded between two internal networks.</p>

<p>Can this bug be changed to a New feature/Improvement or no plans to implement such feature?</p>

**Comment by vvalderrv** [comment]
<p>This is not a bug. It is a request for a feature/functionality not supported by the current nat44-ed plugin.</p>

**Comment by vvalderrv** [comment]
<p>Basically what I got from your configuration is:</p>

<p>GigabitEthernet0/5/0 203.0.113.1/30 (public)</p>

<p>GigabitEthernet0/7/0 198.51.100.1/25 (public)</p>

<p>GigabitEthernet0/6/0 172.16.0.1/24 (private)</p>



<p>What exactly is for you external interface ... I would guess GigabitEthernet0/5/0.</p>

<p>Communication between</p>

<p>a) Gb6 -&gt; G5 should be mangled by NAT using NAT address</p>

<p>b) Gb5 -&gt; Gb7 and Gb7 -&gt; Gb5 no mangle - no NAT</p>

<p>c) Gb6 -&gt; Gb7 (no idea here ??)</p>

<p>Forwarding feature</p>
<ul>
	<li>is used in conjunction with static mappings when you want to do only translations for the static mappings and pass the rest of the traffic without mangling it.</li>
	<li>this is not applicable in your scenario if you are trying to achieve PAT aka dynamic NAT.</li>
</ul>


<p>If a device is configured as an OUTPUT nat device all ingress traffic will get dropped. Usually, the OUTPUT device is the public-connected interface (WAN port).</p>

<p> </p>

<p>If a device is configured as an INSIDE nat device all ingress traffic will get translated - will create a dynamic session.</p>

<p> </p>

<p>Basically what you should use is :</p>

<p>set interface nat44 out GigabitEthernet0/5/0<br/>
set interface nat44 in GigabitEthernet0/6/0</p>

<p>Though any other traffic will get dropped. This is the starting point to find your solution.</p>

<p>The problem here is that any ingress communication on GigabitEthernet0/5/0 will get dropped by the nat44-ed-out2in-slowpath node because there is no session created for this traffic.</p>

<p>What you are looking for is a bypass for traffic this is not supported at this moment by the nat44-ed plugin.</p>

<p> </p>

**Comment by vvalderrv** [comment]
<p>If you have a scenario where you want to nat only traffic from specific LAN interfaces you should not use output-feature. You should go with manually configuring inside and outside nat interfaces.</p>

<p>IFACE0 (LAN)</p>

<p>IFACE1 (LAN) (inside interface)</p>

<p>IFACE3 (WAN) (output-feature)</p>

<p>IFACE4 (WAN) (outside interface)</p>

<p>IFACE0 -&gt; IFACE3 traffic get's translated after ip4-lookup node.</p>

<p>  - basically, all traffic entering the IFACE3 interface because of FIB table/routing will get translated and use one of the configured NAT IP addresses.</p>

<p> IFACE1 -&gt; IFACE4 or ANY</p>

<p> - basically, all traffic entering the IFACE1 interface gets translated, doesn't matter what's the outside interface.</p>

<p>IFACE4, IFACE3 -&gt; ANY</p>

<p> - all traffic coming back from WAN will get translated based on the existing session.</p>

<p> </p>

<p>forwarding:</p>

<p> - misconception of how it should be used. forwarding is used with inside nat interface, not output-feature.</p>

<p>I would also suggest the most recent release of NAT. If not even master. NAT is undergoing heavy changes in the control and data plane.</p>

<p>I have recently changed the configuration of the output feature and its workings. (MASTER branch)</p>

<p>I will look into the issue and try to reproduce it.</p>
